title,company,description,location,salary,is_remote
data scientist - new college grad,,analyze data to research and improvement classifiers.proficiency in data exploration techniques and tools.oversee creation of data sets for machine learning…,"sunnyvale, ca 94085",,0
"data science manager, analytics",,"apply your expertise in quantitative analysis, data mining, and the presentation of data to see beyond the numbers and understand how our users interact with…",remote+8 locations•remote,,1
data scientist,,"demonstrate strength in sql, nosql, etl modeling, data modeling, data caching, schema design and data warehouse architecture.","lehi, ut 84043+1 location",,0
ai/ml - data scientist (machine learning & natural language)...,,"master's or phd in computer science, linguistics, a data-driven physical science, or equivalent.this is an unusual opportunity that sits at the cutting-edge of…","seattle, wa",,0
data engineer,,"work experience related to data engineering, information, and data management.data engineers work with data consumers to create and populate optimal data…","washington, dc 20505 (foggy bottom area)","$64,137 - $159,286 a year",0
data scientist,,"you use data science tools like sql and python (pandas, numpy) and you have a track record of picking up new tools along the way.",remote•remote,,1
associate data science analyst,,"modifies scripts or software applications to support data management, data extraction and data analysis as required.the minimum pay rate is $25.59 per hour.","rochester, mn 55901",,0
goodnight distinguished professor in artificial intelligence...,,"working title goodnight distinguished professor in artificial intelligence and machine learning.the department of computer science is an academic, teaching,…","raleigh, nc",,0
"senior data engineer, data security & privacy",,create data tools for analytics and data science teams.wrangle data model modifications to accommodate source data changes.a strong sense of ownership.,"san francisco, ca",,0
ultimate hoops statistician,,experience tracking full statistical data for basketball games.the statistician assists in the execution of ultimate hoops basketball league by tracking full…,"boca raton, fl 33431",,0
data engineer,,expose data as consumable data sources for analytics via apis and data virtualization services such as denodo.able to clearly define data quality issues.,"durham, nc",,0
statistical programmer 5,,"advise data management staff on database design, and critical data.provide expert statistical input into and review of statistical deliverables (i.e. analysis…","durham, nc",,0
data scientist advisor,,works closely with data scientists and data engineers to develop machine learning algorithms.provide expert leadership at the enterprise level related to vast…,"brookfield, wi+3 locations",,0
data lab architect,,"hands on experience as a database, data warehouse, big data/analytics developer or administrator, or work as a data scientist.","chicago, il",,0
data engineer,,"hii- technical solutions division (tsd) is currently seeking a data engineer in either their san antonio, tx or annapolis junction, md office who will be able…","san antonio, tx 78251",,0
director ml & predictive analytics-remote,,"tactical: develop meaningful data models in commonly used data science packages (python, r, etc).ability to expand solutions’ reach into ot environment …","milwaukee, wi•remote",,1
sr. data analyst,,responsibilities beyond developing data analysis solutions may include participation in component and data architecture design technology planning product…,"detroit, mi 48201 (midtown area)",,0
data analytics fellow,,you will be involved with researching administrative and auxiliary data sources to enhance the transportation data.u.s. department of transportation (dot).,"washington, dc",,0
business/management,,"priority will be given to candidates with teaching/research interests in business analytics, and experience in data mining, data visualization tools, machine…","northridge, ca 91330",,0
"director, data science, pharmacy personalization",,actively contributing in the data science recruiting strategy across enterprise analytics.experience founding and managing data science teams and acting as a…,"wellesley, ma",,0
"advanced data insight analyst ii--(product analyst, search a...",,"2+ years’ data analytics experience in a business context.you have that curious streak - want to investigate that data point, find that insight, understand how…","seattle, wa 98119+1 location (queen anne area)",,0
senior data scientist - digital health,,provides advanced data science expertise to astrazeneca projects and recommends data science solutions.the team is looking for a senior data scientist to…,"waltham, ma 02451+2 locations",,0
data scientist,,"training and development opportunities at cutting edge data-science conferences across the country.their ability to understand, navigate, and manipulate a…","glen allen, va 23060",,0
data scientist,,at least three years of applicable data science experience.ability to skillfully apply data science principles and theory.,"redwood city, ca",,0
sr principal data scientist-ai/ml (remote-united states),,data science is all about breaking new ground to enable businesses to answer their most urgent questions.solve complex business and customer issues utilizing…,"houston, tx•remote",,1
data science & analytics development program 2021b,,"knowledge of applied statistical analysis, modeling techniques, and data visualization methods.title: data science & analytics development program 2021b -…","moline, il 61265",,0
data science consultant,,"experience with data gathering, data quality, system architecture, coding best practices.experience with perception (e.g. computer vision), time series data (e…","richardson, tx 75082",,0
data scientist - philippines,,works with clients to manage and explore data to discover business opportunities.assists in the implementation of sophisticated models with their systems and…,united states,,0
data scientist,,influence priorities: review market conventions and data relationships to set rules for data validation.proficiency using data and statistical modeling and…,"princeton, nj 08540",,0
natural language processing specialist,,you see patterns when looking at data of user behavior and can see the user’s intention.no nlp experience is required.we will provide all the training needed.,"evergreen, co 80437",,0
data scientist (mid) - data & analytics - it - cs - us,,"familiarity with advanced data science topics like autoencoder, numerical optimization, transfer learning etc.","chesterfield, mo 63017",,0
"data engineering director, analytics (ads)",,"establish the processes needed to achieve operational excellence in data fidelity, data privacy, system reliability, and enabling rapid experimentation and data…","menlo park, ca 94025+1 location",,0
data scientist,,"must be able to both manage and manipulate large data sets, develop data science approaches, and manage data science tasks.","tampa, fl+2 locations",,0
north america market specialist,,6+ months experience working with data.we need influencers who can align cross-functional partners to ensure the best possible experience for our platforms.,"austin, tx",,0
data scientist: personal auto telematics (remote),,"solid understanding of data science methods (both statistical and machine learning models).perform data mining towards telematics data collected from gps,…",wisconsin•remote,"Up to $162,500 a year",1
analyst - software engineer / data engineer / data scientist...,,"data scientist analyst: you will perform statistical data analyses, data mining and optimizations using multiple tools and techniques to get insights from large…","atlanta, ga","$90,000 a year",0
statistician,,"the statistician will provide scientific, technical, and professional assistance including but not limited to: scientific, clinical, and professional support to…","atlanta, ga 30341",,0
senior data scientist & analytics engineer job,,experience working in a data intensive environment and translating business needs into data requirements.the senior data science and analytics engineer is a…,"conyers, ga 30012",,0
department of applied data science lecturer pool,,this program provides students with the advanced education necessary to draw insights from real data and apply analytical skills to solve practical problems.,"san jose, ca",,0
insurance statistical coding analyst,,"analyze data for efficiencies in workload, error analysis and possible solutions, reconciliation of data, etc.basic commercial insurance knowledge preferable.","township of warren, nj",,0
nya - data & analytics (da),,"assembling large, complex data sets that meet functional/non-functional business requirements.everyone is working on the same projects; creating and testing as…","franklin lakes, nj",,0
mathematical statistician - direct hire,,"the ideal candidate is familiar with a full range of mathematical statistical data, especially transportation related data.","salt lake city, ut","$107,807 - $140,146 a year",0
tensor factorization and mathematical optimization postdocto...,,"analyze high-order data collected from high-throughput experiments and facilities.in this position, the researcher will contribute to the design and analysis…","san francisco bay area, ca",,0
sr manager - business intelligence,,"7+ years’ experience working in data analytics, data science, or related field.understanding of data engineering pipelines and processes.","detroit, mi",,0
decision analytics consultant,,"our teams work on multiple projects simultaneously, leveraging advanced data analytics and problem-solving techniques.contribute to internal firm activities.","san francisco, ca+8 locations",,0
sr inventory management operations analyst,,"experience sourcing data from relational databases (db2, postgresql, sqlite) and no sql data stores (hadoop, restful apis, kafka).","minneapolis, mn 55402 (downtown west area)",,0
senior engineering statistician,,the engineering statistician will work effectively with others to address engineering and business needs within a rigorous statistical framework.,"east hartford, ct 06118",,0
senior deep learning engineer,,"experience building large scale data processing pipelines.investigate innovative machine learning, artificial intelligence and statistic techniques for health…","gaithersburg, md 20878",,0
senior statistician,,provides biostatistics expertise in clinical development projects by supporting project statisticians.support clinical development and study planning.,"parsippany, nj",,0
"ese tenured or tenure-track faculty, information and decisio...",,"information and decision systems (control, optimization, robotics, data science, machine learning, communications, networking, information theory, signal…","philadelphia, pa 19104 (university city area)",,0
adjunct – dsc-550: neural networks and deep learning – onlin...,,"this course introduces deep artificial neural networks, reviewing the theoretical concepts and practical applications in data science.",united states,,0
"machine learning/nlp - software engineer iii- charlotte, nc",,"these solutions must overcome issues of complex data (e.g., vldb, multi-structured, ""big data"", etc.).build models, solutions and infrastructure to support…","charlotte, nc 28202 (first ward area)",,0
senior programmer writer - ai/ml,,"degree in computer science, mathematics, a related field, or equivalent experience.experience using content publishing tools to write, format, manage, and…","east palo alto, ca",,0
epidemiologist (emergency preparedness team),,experience in data science and designing/operating a surveillance system integrating multiple data systems.monitor and analyze cdph emergency operations staff…,"richmond, ca",,0
postdoctoral appointee in machine learning and uncertainty q...,,"experience in computational science and software development.phd in a field of materials/physical sciences, applied mathematics, or engineering.","livermore, ca 94551",,0
adjunct faculty- business data analytics,,responsible to provide excellence in teaching through the fulfillment of the missions and strategic goals of the school of business.,"saint paul, mn 55113",,0
senior quantitative risk analyst,,experience working with different lines of business to accomplish modeling and data solutions by translating business requirements into data needs/techniques.,"enfield, ct 06082",,0
business analytics advisor (collaborative care advanced anal...,,"strong healthcare data knowledge and hands on experience (medical claims data, clinical data, pharmacy data and eligibility data).","bloomfield, ct",,0
data engineer aws database,,develop data migration plans to migrate legacy on-premises databases into aws data stores.conduct research on different approaches to data storage in aws.,"des plaines, il",,0
analytics strategy – financial services industry,,"1 year using ai and data science.familiarity with using cloud services aws, google, azure or big data tools hadoop, hive, spark in data science solutions.","boston, ma+4 locations",,0
decision analytics associate consultant/forecasting,,bachelor's or master's degree required in any discipline with strong record of academic success in quantitative and analytic coursework such as operations…,"san francisco, ca+5 locations",,0
applied scientist - computer vision / amazon robotics,,"the discipline to fast-fail when data refutes theory;phd in engineering, technology, computer science, machine learning, robotics, statistics, mathematics or a…","north reading, ma 01864",,0
"senior data analyst - uhc m&r is - horsham, pa",,"this function is not intended for employees performing the following work: production of standard or self-service operational reporting, casual inference led …","horsham, pa 19044",,0
data science architect,,"experience with automating data science and machine learning processes and pipelines.bachelor’s in data science, engineering, computer science, similar…",remote•remote,,1
data scientist,,"develop and perform standard queries to ensure data quality, identify data inconsistencies, missing data and resolve as needed.","parsippany, nj 07054",,0
"palmyra atoll data scientist (junior specialist), marine sci...",,"masters or doctoral degree in ecology, environmental science, data science, computer science, or a related field.experience in data management and/or analysis.","santa barbara, ca 93106",,0
"associate director, data science",,"apco insight’s data science team is increasingly involved in assignments employing statistics (e.g., linear/logistics regression, clustering) to develop…","raleigh, nc+3 locations",,0
data scientist,,"strong data engineering, and data management expertise with demonstrated data transformation and manipulation experience.","boston, ma",,0
data scientist,,"create data views and own data quality.this role is a mix of data science, engineering and business analytics.partner with business to solve problems.","atlanta, ga 30328",,0
industry data strategy and analytics leader - opportunity fo...,,perform quantitative analysis and data mining of external industry data as well as vmware data.perform and/or work closely with the data sciences coe and other…,"jacksonville, fl+2 locations•remote",,1
data scientist,,"transform raw source data into analytics-ready data models using reproducible tools.2+ years of experience in a data science, analytics, or research role; or a…","brooklyn, ny",,0
data scientist (remote) - new york,,"have strong sql skills and enjoy extracting and manipulating data.help analyze, explore, model and gain insight from data.",new york state•remote,,1
"data science director, integrity foundation",,experience with large data sets and distributed computing (hive/hadoop).the perfect candidate will have experience building and managing world-class analytics…,"menlo park, ca 94025",,0
data analyst and visualization specialist,,"bachelor’s degree and/or advanced certification in computer science, data science, or similar technical field; or 4 years of experience using software for data…","raleigh, nc","$70,000 - $82,000 a year",0
machine learning/ai,,"ms or ph.d. candidate computer science, or related stem field.understanding and modeling human behavior is essential for driving safely through crowded…","san jose, ca",,0
data analyst,,"experience with statistical analysis/data science.own the aggregation and reporting of manufacturing systems data, including – mes data, shop floor trend data,…","redmond, wa",,0
location strategy data analyst - fcs,,"ba/bs in data science, finance or business administration preferred.strong research and quantitative data modeling skills: experience working with large data…","menlo park, ca 94025",,0
"market senior clinical pharmacist - telecommute in ut, id",,"analyze data and prepare management summaries related to work stream results, performance mgmt.the market sr clinical pharmacist serves as a subject matter…","meridian, id 83680•remote",,1
scorekeeper (statistician),,job description: arrive fifteen (15) minutes prior to tip-off of scheduled game.maintain an accurate account of all processes associated with the game.,"los angeles, ca+1 location",$10 an hour,0
"assistant/associate professor (college for health, community...",,highlighted position: assistant or associate professor with expertise and research in data science related to human performance; a joint appointment in the…,"san antonio, tx 78249",,0
sr. pre-sales solutions architect - health and life sciences...,,"advanced knowledge of cloud and data science technology and architecture.possesses a strong knowledge of cloud, data science, and technology from sas or open…","cary, nc 27513",,0
sr iot data architect,,experience developing solutions leveraging data science and analytics.bachelor's degree or equivalent experience.this is a customer facing role.,united states,"$122,300 a year",0
"senior software machine learning engineer, service intellige...",,collaborate with engineers and data scientists to push the pace of innovation and experimentation by introducing best practices.,"austin, tx 78744+1 location (franklin park area)",,0
opportunity in machine learning and data science for buildin...,,an advanced degree in computer science or a related field with a focus on machine learning and data science.collaborate with bto staff in the assessment of the…,"washington, dc (southwest federal center area)",,0
"business analyst, logistics",,"2+ years of demonstrated quantitative and qualitative data science experience with impact to a business, a track record of problem solving using software…","bellevue, wa",,0
sr data analyst,,"work directly with users in defining new application requirements and resolving project issues.respond to user problems, explain new technologies, and present…","chicago, il 60661 (near west side area)",,0
product innovation lead,,"artificial intelligence, machine learning, big data and cloud platforms form ""the brain"" underpinning these solutions.measured on roi of asset investment.","san francisco, ca",,0
machine learning: hydraulic & environmental data,,"qa/qc of historical data.monitoring and maintaining real-time data collection.the participant will learn specialized data collection techniques using advs,…","vicksburg, ms",,0
federal - etl developer engineer,,participate in troubleshooting and resolving data integration issues such as data quality.experience using python and spark/python/sql and common data science…,"st. louis, mo 63110 (botanical heights area)",,0
"principal statistician, late oncology",,"our robust pipeline includes investigational therapies in varied stages of clinical development, from recently approved products to earlier-stage molecules in…","gaithersburg, md 20878+1 location",,0
part time faculty for business analytics,,it provides students with the skills to conduct analyses with large sets of data to inform business decisions.,"san francisco, ca 94133 (russian hill area)",,0
ai engineer,,work with a team of engineers and cross-divisionally with our partners to identify and define business problems suitable for artificial intelligence actively…,"atlanta, ga",,0
director of data & analytics,,"key areas of expertise may be in the realms of data science, analytics & research, or data engineering.you’re familiar with modern applications of data science…",remote•remote,,1
"data scientist - user segmentation (remote, 6 months)",,advanced data skills using r or python.5 or more years experience in data analysis and statistics.we utilize benchmarking and peer organization data to ensure…,california•remote,,1
manager - data analytics,,the manager - data analytics is responsible for the oversight and development of data analysts and supports other icas teams by helping to design and perform…,remote•remote,,1
biostatistician iii (remote position),,"experience with data science techniques including machine learning and associated software a plus.assesses relevant literature as well as existing data,…",united states•remote,,1
research data scientist,,"an understanding of data pipelining and automation, with experience using pyspark on large data sets – over 1b data points.","new york, ny 10019 (midtown area)",,0
2021 global data science advanced graduate quant sci track c...,,"candidates will learn the underpinnings of data science techniques to supplement existing biostatistical knowledge.please, no phone calls or emails.","kenilworth, nj",,0
data scientist,,fraud analytics – analysts on the fraud team use advanced data mining techniques to identify and fight online fraud.,"chicago, il",,0
remote data science manager,,build and execute the data science strategy.implement agile framework to data science discipline.successful track record of building data science platforms.,"hire, ne•remote",,1
operations research data scientist (remote),,collaborate with engineering teams to design and implement software solutions for data science problems.understand ambiguous business problems and convert them…,"northbrook, il•remote","$86,000 - $130,000 a year",1
data scientist,,this opportunity is great for professionals with a shared vision of building an extraordinary platform and serve healthcare consumers through the power of data…,remote•remote,,1
"data science manager, ads delivery product",,"experience using data to drive product and business decisions.you will be formulating product strategy, understanding key drivers of advertiser value, and…","menlo park, ca 94025",,0
data analyst,,you have 2+ years of experience in a data analytics and/or data science role using quantitative tools to drive business decisions.,"los angeles, ca 90028 (hollywood area)",,0
data scientist,,"examples include, visualization tasks, bi meta data model development, data loading, data cleansing, etc.this position is not ideal for a data scientist who…","baltimore, md 21201 (mid-town belvedere area)",,0
senior data analyst,,3+ years working as a data analyst or equivalent experience working with data within a role or function.perform exploratory data analysis to inform business…,"portland, or 97204+11 locations",,0
sr. data scientist - it,,"drive the design, building, and launching of new data models and data pipelines in production.interface with engineers, product managers and product analysts…","san mateo, ca 94401 (central business district area)",,0
computational mathematician/statistician,,"machine learning, data analysis, applied statistics, and uncertainty quantification.quantum information sciences, including quantum computing, networking, and…","lemont, il 60439",,0
associate staff - applying ai & machine learning to multispe...,,"from these large datasets, you will create training and test data sets that are usable by ai/ml applications.no less important, the interdisciplinary nature of…","oak ridge, tn 37830",,0
data scientist - merchandising analytics,,2 years of experience in data science or advanced analytics in industry.our merchandising analytics team is building out a multi-faceted data science tool that…,"charlotte, nc 28202 (downtown charlotte area)",,0
"sr. manager, data science and analytics",,"creates actionable recommendations and insights, to address business objectives, through the analysis and modeling of quantitative and qualitative data.","philadelphia, pa",,0
data engineer/technology analyst (term) - ma,,"the mpoa data engineer term position requires a bachelor's degree in computer science, data science, computational statistics, or a related field with at least…","washington, dc (foggy bottom area)",,0
assistant scientist - nanoscience,,"experience in machine learning, artificial intelligence, and data science applied to materials science and/or nanoscience.","lemont, il 60439",,0
sr. data analyst,,summary the senior data analyst will provide technical leadership in the implementation of data systems and is responsible for development and implementation of…,"san antonio, tx",,0
machine learning - speech,,"master’s degree or phd in computer science, mathematics, engineering, computational linguistics, or work experience of minimum 2-3 years.","spring valley, ny 10977",,0
r&i data scientist,,gather internal or external data and validate data quality.a minimum of 2 years of data science and ai experience.very good communication skills in english.,"princeton, nj 08540",,0
assistant or associate professor in understanding land-water...,,candidates must demonstrate expertise and research productivity in data-driven science and show a strong interest in interdisciplinary research and teaching.,"university park, pa",,0
