title,company,description,location,salary,is_remote
data scientist,,develop custom data models and algorithms to apply to data sets.assess the effectiveness and accuracy of new data sources and data gathering techniques.,"piscataway, nj 08854",,0
data engineer,,"build enterprise data assets that will be used for reporting, analytics, and data science.2+ years' experience data modeling for analytical data assets.","dallas, tx",,0
health care data scientist,,"conduct exploratory data analysis from complex, disparate data sources to recognize patterns, and identify member performance improvement opportunities.","irving, tx 75062 (las colinas urban center area)",,0
"director data science, advertising product",,lead the data science team in building data products powering our advertising and monetization platform.consistent record of leading and influencing projects…,"foster city, ca 94404",,0
data scientist,,"2+ years of experience in statistical analysis, data mining, machine learning algorithms and their application in various industries.","atlanta, ga+1 location",,0
"principal tech program manager (tpm), aws ai - computer visi...",,"in the process, you will work closely with data, science and engineering teams to invent on multiple dimensions ranging from data processing at scale, to model…","bellevue, wa",,0
"registered nurse, college hill/adolescent/pa3w, 0.6fte, nigh...",,"collects clinical data; follow algorithms, decision trees, and protocols.subfunction definition: nurses who have graduated from a college level nursing program…","cincinnati, oh 45224 (college hill area)",,0
software engineer ii-artificial intelligence/machine languag...,,"experience with non-traditional data storage technologies (e.g., cassandra, elasticsearch, solr, mongodb, graph stores, minio for block storage).","richardson, tx",,0
postdoctoral fellow - public health research: bioinformatics...,,strong statistical and data science skills in a programming language such as r or python.the successful candidate will have freedom to explore their own…,"duarte, ca 91010",,0
release manager - enterprise analytics,,provide actuarial perspective in technical meetings with data engineering and data science teams working on developing new features of the uw platform.,"woonsocket, ri",,0
data engineer,,strong understanding of modern analytics using machine learning and data science.3-5 years’ experience in loading source system data extracts into data…,"san antonio, tx 78245",,0
ml engineer,,2-3 years of experience working with hadoop big data platform and spark using pyspark for data transformation/data preparation coding.,"new york, ny",,0
respiratory therapist- liberty campus,,"assesses patients, clients and families and recognizes normal parameters, deviations and abnormalities in physical, emotional, developmental and behavioral…","township of liberty, oh 45044",,0
natural language processing (nlp) engineer,,"building an active learning framework for labeling of chat data at scale.based on 8 years of research at mit, and inspired by the human ability to acquire…","boston, ma 02116+1 location (back bay area)",,0
instructor/senior instructor- informatics and data science t...,,"maintain a calendar of data science training and education offerings.domain knowledge of bioinformatics, data science, analytics.","aurora, co",,0
data scientist,,"the data scientist will use a diverse range of data-focused skills and experience, both technical and analytical.","mclean, va+1 location",,0
data engineer ii,,create data tools for analytics and data science team members that assist them in building and optimizing solutions to become an innovative industry leader.,"springfield, mo•remote",,1
analyst,,"use modern technology, statistical analysis and data science to streamline line of business specific processes while maintaining high data quality.","jersey city, nj",,0
"data scientist, radio & music informatics science",,"design, build, and a/b-test improvements and innovations to siriusxm + pandora’s algorithmic radio, playlist, and recommendations products.","atlanta, ga 30361+1 location (midtown area)",,0
gpu advocate nala,,high performance computing (hpc) and artificial intelligence (ai) are key markets for nvidia.researchers and scientists are actively embracing gpu programming…,pennsylvania•remote,,1
principal applied researcher machine learning,,"perform or assist in data collection, data cleaning, data analysis, algorithm selection or design, feature engineering, model training and evaluation, and…",remote•remote,,1
"senior data engineer, python - remote - u. s.",,"experience in data stream processing tools to ingest, process, enrich and store various data assets.understanding of complex data flows, identification of data…","englewood, co•remote",,1
data architect,,"assist in enabling state-of-the-art data offerings for data mining, data analytics, data science, real world data, visualization, and machine learning.","morrisville, nc",,0
principle data scientist security advisor,,"helps define, drive and deliver all aspects of the data science product lifecycle, from requirements gathering, education, and strategy, to study design,…",pennsylvania•remote,,1
data lead,,ability to manage time in accomplishing complex tasks while coordinating and mentoring data migration technicians is a plus.,"allentown, pa",,0
federal azure data & ai sales specialist - dhs,,3-5 years experience selling business solutions to federal / civilian customers or to us department of homeland security with a focus on data platform…,"washington, dc",,0
data science and engineering director,,experience in tensorflow and other data science and data engineering frameworks.you will also play a pivotal part in the evolution and growth of our data…,"high point, nc 27265+2 locations",,0
"data scientist (dallas, tx",,manipulate and process large multisource data sets.ability to query complex data from database.experience in developing database and data-driven applications.,"phoenix, az+1 location",,0
data & insights - data scientist,,"qualified candidates need to possess 4+ years of analytic consulting / data science experience.experience with nosql; streaming data, big data, python data…",remote•remote,,1
data science qa,,"a. validate quality of input data and output results of models/solutions;c. validate the entire pipeline including: data ingestion, feature engineering, model…","miami, fl",,0
associate research & development data scientist,,the associate r&d data scientist is directly responsible for contributing to multiple components of the naep process data development for data science.,"princeton, nj 08541",,0
data scientist/data engineer - location: mclean or washingto...,,developing and maintaining data pipelines.monitoring data quality across multiple projects.experience automating data pipelines for multiple projects.,"mclean, va 22102",,0
machine learning prototyping software engineer,,"we're looking for engineers who bring fresh ideas from all areas, including information retrieval, distributed computing, large-scale system design, networking…","san francisco, ca",,0
associate data engineer,,"the associate data engineer will work closely with the data science team, along with additional internal stakeholders in building the data infrastructure to…","salt lake city, ut",,0
marketing science analyst,,"partner with internal teams in data strategy, data science, activation, business intelligence, account management, and ad/revenue operations to optimize…","new york, ny",,0
data scientist,,contribute to the development and maintenance of our data infrastructure to enhance the cleanliness and effectiveness of our data sources.,"chicago, il 60606 (west loop gate area)",,0
data science analyst,aci federal™,5+ years data science analyst experience. creating and editing/updating data scripts using r for use by tiu. cyber threat intelligence analysis and reporting.,"falls church, va",$39.38 an hour,0
data analyst,pensa systems,a solid understanding of data mining & big data techniques. the data analyst will be in charge of understanding and operationalising data delivery by sifting…,remote,,1
data scientist,"forward air, inc.",present information using data visualization techniques. work with stakeholders throughout the organization to identify opportunities for leveraging company…,"forest park, ga +1 location","$85,000 - $120,000 a year",0
associate data scientist,permanent general assurance corp.,"as an associate data scientist, you will be involved first hand with actual data science projects and writing code that matters.","nashville, tn","$76,440 a year",0
data analyst,nova collective,"working with raw survey data to produce clean data sets for analysis and reporting. do you bring a strong background in survey data principles, such as:","chicago, il",$30 - $35 an hour,0
data science opportunities/ entry level for recent graduates stem,pcs global tech,"provides plan with data, reporting and analyses that enable data driven decision making. data science: 1 year (required). temporarily due to covid-19.","irvine, ca",,0
reporting and data science analyst,quality built,"support the design of end-to-end data visualizations/reporting solutions, from data extraction to the presentation, to address the clients’ needs.","denver, co +4 locations","$65,000 - $80,000 a year",0
data engineer,central intelligence agency,"work experience related to data engineering, information, and data management. data engineers work with data consumers to create and populate optimal data…","washington, dc","$64,137 - $159,286 a year",0
"administrative assistant, data science & engineering",netflix,we are seeking an experienced administrative assistant to provide support to directors in data science and engineering.,"los gatos, ca +1 location",,0
data visualization analyst,atlas executive consulting,"user interface design and prototyping data visualizations. 4 years of experience developing, implementing, and supporting the usage of data visualization…","north charleston, sc +1 location","$95,000 a year",0
data scientist (no sponsorship offered),"tek-tree, llc","data science: 4 years (required). one of the scripting language python etc. sql and pl/sql development, including code debugging, query analysis and performance…",remote,$65 - $70 an hour,1
data scientist,millennium software solutions,"clustering of mixed event, real time data in order to determine clear operating regimes. the event data is process alarms from a refinery, chemical plant or…","west kingston, ri",$70 - $75 an hour,0
"analyst i, data science",liberty mutual insurance,gain confidence in skill application using analytics and data science techniques to manipulate large structured and unstructured data sets in order to generate…,remote +4 locations,"$87,900 - $123,200 a year",1
data science technical trainee,booz allen hamilton,"participation in partnerships with data science leaders, like our partnership with nvidia to deliver deep learning institute (dli) training to the federal…","beavercreek, oh +1 location",,0
data analyst,intellisoft inc,"conduct data quality assurance activities, including the identification and resolution of data errors. master's degree or higher in statistics, data science,…","atlanta, ga",$55 - $65 an hour,0
data scientist i,govstrive llc,"support the collection, preparation, and management of client data and publicly available datasets such as the federal employee.","dublin, ga",,0
python & data science mentor,nestria,feel free to apply if you think that you have adequate credentials to mentor job seekers for tech industry jobs in software development or data science.,remote,$18 - $100 an hour,1
basketball statistician,performance analytica llc,"if you are a tech savvy individual with a proven background in basketball stats, performance analytica wants you to be part of our team.",remote,$10 - $15 an hour,1
data scientist,audiohook,present information using data visualization techniques. identify valuable data sources and automate collection processes. analytical mind and business acumen.,remote,"$50,000 - $80,000 a year",1
need data analyst / data science consultants,advansys inc,demonstrated data visualization literacy and the ability to select visualizations appropriate for a given business need.,remote,"$75,000 - $140,000 a year",1
associate data scientist,university of maryland,"experience querying databases and large data sets to combine and manipulate data (e.g., import data, assess missingness, filter, transform variables, derive…","college park, md",,0
data scientist,tekshapers inc,"experience with building/tuning models inferencing against time series data. to create all quality documents, collect metrics data and conducting audits.","rahway, nj",$60 - $65 an hour,0
product manager – data science,kanini software solutions,this person will also be responsible for managing the team providing data pipeline work to the unsupervised system. working at kanini is flexible and personal.,"nashville, tn",$60 - $80 an hour,0
"junior data analyst, data & analytics","lockerdome, inc.","additionally, you’ll contribute to lockerdome's code base, working with large datasets within our platform and supplemental client data to build tools that are…",remote,,1
data scientist,"continental finance company, llc",creating complex data visualizations in tableau. creating complex custom data queries in sql. creating complex data models in sas or r or python.,"wilmington, de","$80,000 - $100,000 a year",0
machine learning engineer,telesis,transform and convert data streams into structures needed for algorithm input. they will collaborate with data scientists to design tools to train machine…,"tampa, fl","$130,000 - $140,000 a year",0
data scientist,us department of veterans affairs,"this position drives agency innovation and delivers expert business intelligence with respect to data governance, data visualization, data analysis and…",remote,"$92,143 - $140,000 a year",1
technical sourcing recruiter – data science,hbo,"hbo offers competitive benefits to include medical, dental, vision, a matched 401(k) plan, flexible spending, a commuter benefit program and tuition…","new york, ny",,0
technical sourcing recruiter – data science,warnermedia,"hbo offers competitive benefits to include medical, dental, vision, a matched 401(k) plan, flexible spending, a commuter benefit program and tuition…","new york, ny",,0
data scientist,delaware nation industries,work with social science researchers to identify relevant data needs for policy-oriented research purposes. contribute to and help maintain data structure for a…,"washington, dc +1 location","$130,000 - $140,000 a year",0
"data scientist, modeling & simulation team",blueprint power,gather and characterize data inputs and outputs for the models. has 3-5 years of experience in python programming and 1+ years of experience using modeling and…,remote,"$78,795 - $182,856 a year",1
predictive modeler,lancer insurance company,data analysis: 1 year (preferred). collaborate with stakeholders to integrate data mining results with existing systems. experience with python a plus.,remote,"$75,000 - $125,000 a year",1
data scientist,squadmethod,"data scientists: *machine learning : will develop, evaluate and modify algorithms and algorithm ensembles to performance against various network data sources…",remote,,1
data science recruiter,southwest airlines co.,"the data science recruiter manages the full lifecycle of recruiting while maintaining strong relations with business leaders, hiring managers, human resources…","dallas, tx",,0
ai/ml data scientist,fintek solutions llc,"8+ years of or, statistical or data mining algorithm development experience, including 5+ years of ai/ml development experience for real-world applications.","atlanta, ga",$45 - $50 an hour,0
deep learning engineer (full-time),generally intelligent,gain real exposure to deep learning research. take time to develop a deep understanding of what makes neural networks actually work by reading papers and the…,"san francisco, ca","$130,000 - $170,000 a year",0
"product analyst, subscriptions",quizlet,"you will be the owner and expert of subscriptions data, enabling you to identify new high-value opportunities, analyze a/b test experiments, recommend data…","san francisco, ca",,0
data science fellow,øptimus consulting,"øptimus analytics, a data science and software company, is seeking a data science fellow in the washington, dc area or remotely.","alexandria, va",,0
data scientist,primeneuro,"ph.d. or master’s in data science, bioinformatics, or a closely related field or b.s. with 3-5 years of post-degree work experience.","durham, nc +3 locations","$95,000 - $105,000 a year",0
data engineer,awning,"integrate third-party data sources with our data infrastructure. you'll also support with data science, machine learning, and engineering work we do.","san francisco, ca",,0
(5) data analyst / data scientist,tra'bian enterprises,once the chatbot is created – will uses analytics data from watson assistant to provide insights into overall bot performance and areas of improvement.,remote,,1
"manager, data science - ads",instacart,build and lead a high-performing team of data scientists. enable objective decision making across the company by democratizing data through dashboards and other…,california,,0
data scientist,clara analytics,"proficiency in python for data science applications. 2+ years of experience with end to end data science pipelines - data ingestion, processing, machine…",remote,,1
data scientist -- full-time,"denali system co., ltd","data science: 3 years (preferred). proven experience in working with large scale data systems. formulating, suggesting, and managing data-driven projects which…","mountain view, ca",,0
"junior data scientist, ml r&d","lockerdome, inc.","build data science models that tie directly into other existing models. strong technical ability in a data-focused programming language, such as r or python.",remote,,1
"analyst, baseball research & development",tampa bay rays,our r&d group helps shape the baseball operations decision-making processes through the analysis and interpretation of data. experience with r or python.,"saint petersburg, fl",,0
"data scientist, artificial intelligence",viridios ai,"advanced data exploration and visualization skills. bachelor’s degree in any technical subject (e.g., computer science, engineering, physics, mathematics, etc).",remote,"$60,598 - $184,293 a year",1
statistical analyst,national independent statistical service,this individual corresponds with company contacts when problems are identified and assists in resolving data questions.,"indianapolis, in",,0
data scientist,united solutions llc,strong experience in manipulating data and drawing insights from large data sets. experience working with and creating data architectures.,"rockville, md","$50,000 - $120,000 a year",0
"data science online course instructor (part-time, contract)",datacamp,"passionate about teaching data science and data fluency skills. talented data science industry professional skilled in either python, r, sql, or sheets (or all…",new york state,,0
mid-level data scientist,atlas executive consulting,minimum four (4) years of experience developing data analytics or data science solutions. ability to manipulate data from multiple structured and unstructured…,"north charleston, sc","$70,000 - $85,000 a year",0
data scientist,target pharmasolutions,aggregate and organize data from disparate sources in support of data analysis. knowledge of healthcare/clinical data desired.,"durham, nc",,0
sports science data analyst,orlando city sc,"degree in computer science, math, data science or related field or a combination of education and 1-2 years experience in statistical analysis and report…","orlando, fl",,0
data scientist,tripoint solutions,conduct data analysis tasks in conjunction with client data smes. this position requires the applicant to parse disparate data sources to find the patterns and…,"alexandria, va +1 location","$90,000 - $95,000 a year",0
data engineer,creditxpert,"closely collaborate with operations and data science to create scalable solutions for product problems. manage data and meta-data, structuring it properly via…","baltimore, md","$96,980 - $153,326 a year",0
quantitative data analyst,"redaptive, inc.",the quantitative data analyst at redaptive leverages any and all available data to answer redaptive’s critical questions.,united states,,0
data scientist - entry level,numerdox,"you will be performing thorough testing and validation of models, and support various aspects of the business with data analytics.","sacramento, ca",,0
"technical sourcer, data science",facebook,"utilizes data for reporting and influencing hiring decisions, while maintaining data integrity. partner with coordinators and recruiters to manage an efficient…",remote +6 locations,,1
junior data scientist,titan america,"experience with common data science toolkits, such as r, python. extending company’s data with third party sources of information when needed.","roanoke, va",,0
associate data scientist,the general insurance,"as an associate data scientist, you will be involved first hand with actual data science projects and writing code that matters.","nashville, tn",,0
data analyst,general motors,our data analytics team supports operational improvement and business decision-making through ad-hoc statistical analysis of curated enterprise data and self…,michigan,,0
data scientist,utility associates,identify valuable data sources and automate the collection of data. our plan is to build a data science team that will help us gain valuable insights from…,"decatur, ga","$110,000 - $135,000 a year",0
"director i, data science",liberty mutual insurance,"develop expertise in products requiring price segmentation and in available analytic data. high-level knowledge of data sources, tools, and the business (lines,…",remote +2 locations,"$126,901 - $179,500 a year",1
media specialist,rooms to go corporate | furniture,"4-year college degree in marketing, advertising, data science or a business-related field. reviews data and reports for quality assurance.","atlanta, ga",,0
vp of content data science & engineering,netflix,inspire and lead your team to deliver data and strategic and novel data science and engineering approaches that help optimize and guide netflix's content…,"los angeles, ca",,0
research associate for economic studies,cato institute,"degree in economics, statistics, data science, or any field that requires strong analytical and writing skills. interest in libertarianism and public policy.",remote,,1
senior data analyst,neal analytics,"this data analyst will require significant experience analyzing data looking for basic patterns and performing business-rule data validation, then producing…",remote,$65 - $70 an hour,1
software architect (machine learning/artificial intelligence),"dynamic placement services, llc","dynamic’s client is seeking a software architect for a permanent position in denver, co (the ideal candidate will be local to the denver area and can go into…","denver, co",,0
"recruiting lead, data science",facebook,"as a recruiting lead on our data science sourcing & recruiting teams, you will work closely with recruiting and sourcing leaders, data science business leaders…",remote +11 locations,,1
machine learning engineer,"e cyber7 technologies, llc",demonstrates solid data science knowledge. designing and developing machine learning and deep learning systems. running machine learning tests and experiments.,"bowie, md","$45,000 - $140,000 a year",0
artificial intelligence trainer,sustainable living lab,"prior working experience at a community college or university level in a content development/training/mentoring role is a must. job types: full-time, contract.",remote,"$6,000 - $7,000 a month",1
healthcare data analyst,clarify health solutions.,experience documenting etl mappings and similar documents to provide data lineage and data transformation logic. testing and qa of all steps of processing.,remote,"$100,000 - $145,000 a year",1
data scientist,doorstead,extending company's data with third party sources of information when needed. enhancing data collection procedures to include information that is relevant for…,"san francisco, ca",,0
data scientist - campus network,ibm,determine the appropriate data collections methods based on the unique data structure and elements. the role will involve working with the cio data lake and…,"research triangle park, nc",,0
data scientist -remote,starbucks,"understands how to break down the data, extract insights, and determine utility within larger data analytic products.","seattle, wa",,0
claims analyst (data mining),trend health partners,interpret and analyze data to accurately assess and demonstrate key insights into trends and opportunities. trend health partners is currently seeking analysts…,"hunt valley, md","$50,000 - $60,000 a year",0
junior data analyst,symphonyrm,experience using dbt to transform data. transform and model data using dbt and lookml. visualize data to communicate findings using platforms such as excel or…,pennsylvania,,0
"public health analyst and data scientist, junior",booz allen hamilton,"2+ years of experience with data science, data analytics, or research analytics. join us as we use data science for good in public healthcare.","bethesda, md",,0
data science tutor,myguru tutoring & test prep,"myguru, a boutique 1-1 tutoring and test prep provider, is seeking experienced a data science/machine learning tutor to join our team.",remote,$40 - $50 an hour,1
