title,company,description,location,salary,is_remote
 data science architect , reliable software resources ,"responsibilities: provides vision, expertise and technology-based solutions in long range planning in the area of systems  architecture. serves as resident expert to conducts studies, investigate the latest technology developments  and analyze impact of current and future system requirements. recommends technology, drafts and presents  proposed corporate policies, drafts and presents proposed procedures, practices and standards. ensures that  new initiatives conform to the firm's long term strat"," reliable software resources  pittsburgh, pa, usa",,0
 full stack engineer with data science ," deegit, inc. ","a full stack engineer with deep understanding of data science and software engineering practices.   job responsibilities: strong computer science fundamentals such as algorithms, data structures, multithreading, object-oriented development, distributed applications, client-server architecture.design and implement machine learning models and data ingestion pipelines.develop and support a platform that enables data scientists to rapidly develop, train, and experiment with machine learning models.e"," deegit, inc.  remote",,1
 principal-pred/pres analytics - data science , ampcus inc ,"hello,   greetings from ampcus inc. ampcus is a technology services consulting company. ampcus inc. is a global leader in end-to-end it business solutions and services with latest technologies. we are listed among the top 50 fastest growing companies in usa. we work closely with our clients for talent acquisition.  we are looking for an principal-pred/pres analytics. this is 6+ months position. your resume is a very good match for this opportunity, please review the job description below and ple"," ampcus inc  alpharetta, ga, usa",,0
 data science director , blend360 ,"edit  dynamic, fast-growing, entrepreneurial data science solutions company seeking seasoned data scientists! if you’ve got entrepreneurial spirit and passion, are driven by results, and want to be a part of significant growth, we’re looking for you!  blend360 is an award-winning, new breed data science solutions company focused on powering exceptional results to our fortune 500 clients. we are a  growing company—born at the intersection of advanced analytics, data and technology. blend360 it is", blend360  remote,,1
 director of data science (3708) , flexion inc ,"flexion is currently seeking a director of data scientist for a direct hire/full-time employee role with our client in minneapolis, mn.  as the director of data science, you will play a key role in unlocking our client's vision - transforming the measure of marketing success - through the development and advancement of measurement methodologies.  you will lead the development of additional analytics solutions, data science tools and application of predictive analytics to meet the needs of our cl"," flexion inc  minneapolis, mn, usa",,0
" manager, data science & analytics "," nutrien ag solutions, inc ","manager, data science & analytics – remote, us nutrien ag solutions is the retail division of nutrien™, the largest crop inputs company in the world. as part of our collective mission of feeding the future, nutrien ag solutions provides full-acre solutions through our trusted crop consultants at more than 2, locations in north america, south america, europe and australia.  working at nutrien ag solutions will provide you an opportunity to help us feed the future, and grow your career.  what you "," nutrien ag solutions, inc  remote",,1
 e-discovery data science advisor ," paul, weiss, rifkind, wharton & garrison llp ","the e-discovery data science advisor uses advanced data science tools and techniques to enable the discovery of insights from client data and enable the analysis, review, and production of structured data throughout the e-discovery process. the e-discovery data science advisor will also use these techniques and tools to support the enhancement and automation of e discovery processes. consult with case teams on effective data modeling, mining and other data analyses as related to e-discovery and "," paul, weiss, rifkind, wharton & garrison llp  new york, ny, usa",,0
 data science lead ," republic services, inc. ","the data analytics lead serves as the primary liaison between leadership and data scientists to leverage information adding value to the organization's workforce. this position works with all levels of hr staff as well as leadership across the organization in assessing needs for various business functions and assists management in identifying, analyzing and recommending data products that add business value.  projects consist of small ad-hoc information requests to large cross functional data in"," republic services, inc.  scottsdale, az, usa",,0
" full stack engineer - (python, data science and machine learning) ", klntek ,"hello please check the below position and reply back with the below details and updated resume if you are comfortable.   job title: full stack engineer - (python, data science and ml) location: no location constrain (across us need to work in pst hours) duration: long term    key skills: python, machine learning and data science. job details: strong computer science fundamentals such as algorithms, data structures, multithreading, object-oriented development, distributed applications, client-ser", klntek  remote,,1
" data scientist lead (data science, python ,powerbi or tableau, retail experience) ", sigmaway ,"apply by email/direct application at  role: data scientist (lead) location: remote interview process: 3-4 steps must haves: minimum of 4 years of data science experience (ideally 5+ but will consider 4, no less)python or rpowerbi or tableauretail experience will not consider anyone without it  jd: you will have an opportunity to directly influence our consumer product roadmaps and work closely with business leaders across e.l.f. beauty. you will be responsible for following to fuel our digital g", sigmaway  remote,,1
" remote senior machine learning engineer - ml, ai, data science ", technology navigators ,"no sponsorship available. no third-party/c2c candidates. this is a 100% remote opportunity. applicants must reside in the united states. our client, a major player in the cutting-edge artificial intelligence industry, brings other companies’ ai strategies up to speed. engineering creative custom solutions with innovative approaches, this company has delivered a clear competitive advantage to both startups and enterprise environments alike. this client has an immediate need for an experienced sen", technology navigators  remote,,1
 it data science consultant sme , stonelaurel consulting ,"it data science consultant sme                               ~ we do not offer c2c or sponsorships agreements ~  ~group benefits options: medical, dental, vision, 401k, flexible spending account (fsa)~ this position is responsible for business consulting activities for the analytics competency center within various business units as the primary interface and as a liaison to information technology: serve as an expert in translating complex data into key strategy insights and valuable actions.disc"," stonelaurel consulting  charlotte, nc, usa",,0
 senior project manager (ai/ml/data science/digital health) - w2 - remote to start off ," softpath system, llc. ","job details  title: senior project manager (ai/ml/data science/digital health)  location: irvine, ca  duration: 12 months    job description:  develop, execute and manage multiple it projects within their defined scope(s). manage a multitude of interrelated project activities and lead all aspects of the project lifecycle, working with project sponsors/key stakeholders, team members, and management to oversee all phases of project completion. build and manage project’s work breakdown structure, m"," softpath system, llc.  remote or irvine, ca, usa",,1
 sap data science consultant , softpath technologies llc ,"hi, greetings from softpath technologies !! pfb the below requirements with my client if you are interested kindly share your resume to pmahaatsoftpathtech.com role: sap data science consultant  exp: 10+yrs   location: cherry hill, nj duration: contract primary responsibilities  use machine learning, deep learning and other data science techniques to create advanced analytics solutions to business problems  wrangle large datasets, identify critical information, develop and test hypotheses and ma"," softpath technologies llc  cherry hill, nj, usa",,0
 data science intern , cannondesign ,"cannondesign has an exciting opportunity for a data science intern to join our technology in practice team. take a look at the description below. if you think your skills and experience make you a good match for this position, wed love to hear from you. were looking for creative, curious, empathetic people to join our living-centered design movement. about our firm  cannondesign is an integrated design solutions firm focused on helping people continuously flourish. whether designing for innovati"," cannondesign  los angeles, ca, usa",,0
 data science intern , cannondesign ,"cannondesign has an exciting opportunity for a data science intern to join our technology in practice team. take a look at the description below. if you think your skills and experience make you a good match for this position, wed love to hear from you. were looking for creative, curious, empathetic people to join our living-centered design movement. about our firm  cannondesign is an integrated design solutions firm focused on helping people continuously flourish. whether designing for innovati"," cannondesign  chicago, il, usa",,0
 data science intern , cannondesign ,"cannondesign has an exciting opportunity for a data science intern to join our technology in practice team. take a look at the description below. if you think your skills and experience make you a good match for this position, wed love to hear from you. were looking for creative, curious, empathetic people to join our living-centered design movement. about our firm  cannondesign is an integrated design solutions firm focused on helping people continuously flourish. whether designing for innovati"," cannondesign  st. louis, mo, usa",,0
 data science , softcom systems ,"role: data science  location: newark, nj ( contract to hire position ) skills: 7+ experience working with data management, analytics and big data technology financial services experience (mutual fund background preferred) experience with data visualization tools (tableau, power bi) experience with hadoop stack and storage technologies such as hdfs, mapreduce, yarn, hive, sqoop, impala, spark, flume, kafka and/or oozie experience with big data analytics & business intelligence and industry standa"," softcom systems  newark, nj, usa",,0
 data science engineer , horn solutions inc. ,horn solutions has partnered with a client in search of a talented data science engineer to join their team for a new data project where they will be standing up their data science environment from scratch. this client is located in las colinas and the position will be partially on site. the position:  we are looking for an experienced data engineer to join our team. you will use various methods to transform raw data into useful data systems. the ideal candidate should have strong analytical ski," horn solutions inc.  irving, tx, usa",,0
 data science manager , deloitte ,"are you looking to make an impact by helping agencies meet their mission goals through successful implementation and operation of their regulatory, mission or compliance programs? are you ready to help our clients mitigate risks that arise from transformational core business operational change or ongoing operations? are you interested in helping clients transform how they operate their business to be more effective? if so, deloitte's regulatory compliance team could be the place for you! our tea"," deloitte  arlington, va, usa",,0
 data science - intern , ss & c technologies inc ,"at ss&c intralinks we pride ourselves on giving each intern a real-world experience and opportunity to hone their skills, build their portfolio, network with professionals and build relationships, in addition to preparing them for a full-time position after graduation. motivated interns play an important role in making this a reality, but we're here to help! about the team:  we see ourselves as a ""start-up"" within a big product company. we cater to all the flagship products, applications and bus"," ss & c technologies inc  waltham, ma, usa",,0
 data science programmer , perspecta ,"peraton overview peraton drives missions of consequence spanning the globe and extending to the farthest reaches of the galaxy. as the worlds leading mission capability integrator and transformative enterprise it provider, we deliver trusted and highly differentiated national security solutions and technologies that keep people safe and secure. peraton serves as a valued partner to essential government agencies across the intelligence, space, cyber, defense, civilian, health, and state and local"," perspecta  mclean, va, usa",,0
 data science manager ," red oak technologies, inc. ","the data science manager is responsible for leveraging structured and unstructured data sets in order to gain critical insight. on how to drive networks, systems, and products forward.  this individual should be an expert data scientist while also being able to lead small teams; responsible for creating machine learning models that help to better understand network capacity, system performance, or licensing consumption across out platforms. the data science manager could be located in any one of"," red oak technologies, inc.  remote",,1
 data science application administrator , saic ,"description saic is seeking a data science application administrator to joing our team to provide support for the division in huntsville, al. this job is temporarily remote / virtual / work from home due to covid-19. will possibly return to the office in huntsville, al once the threat of covid-19 is eliminated. job description: administers cots data visualization application. conducts analysis and collaborates with subject matter experts in the planning, design, development, and execution of ele"," saic  huntsville, al, usa",,0
" manager, data science, analytics ", comscore ,"may 14, 2021  manager, data science, analytics job description  job title: manager, data science, analytics location: reston, va about this role: this position draws on expertise in analysis, big data, and operations to manage and improve the processes that produce comscore's cross-platform, digital, and television audience data. clients around the globe rely on this information to shape business strategies and fuel advertisement buying and selling. this dedicated leader motivates staff and coll"," comscore  reston, va, usa",,0
 director of data science , jobot ,"remote candidates welcome to apply!  this jobot job is hosted by: christina finster are you a fit? easy apply now by clicking the ""apply now"" button and sending us your resume. salary: $275, per year  a bit about us:  confidential search  why join us?  bay area health-tech start-up  series a - with big backings  job details  key attributes: *leadership **managed and delivered data science projects and teams for saas/data platform companies deep domain expertise in ml practices, processes, infras"," jobot  palo alto, ca, usa",,0
 data science product manager , new york life insurance company ,"when you join new york life, you're joining a company that values development, career growth, collaboration, innovation, and diversity & inclusion. we want employees to feel proud about being part of a company that is committed to doing the right thing. through various resources and programs, you can grow your career while developing personally and professionally. the center for data science and artificial intelligence (cdsai) is the 50-person innovative corporate analytics group within new york"," new york life insurance company  new york, ny, usa",,0
 technical project manager(data science) , atmecs ,"hi, position title: technical project manager(data science) location: orange county, ca duration: 12 months solid understanding of agile, scrum and kanban development methodologies.experience with agile project/product management tools like jira and confluence.good understanding of machine learning, data analytics, rule-based systems, and data architecture.experience building solutions based on data, hypotheses, and mvps by defining and aligning on clear requirements, working with a cross-discip"," atmecs  tustin, ca, usa",,0
 data science solution lead ," anthem, inc ","description shift: day job  schedule: full-time  your talent. our vision. at anthem, inc., it's a powerful combination, and the foundation upon which we're creating greater access to care for our members, greater value for our customers, and greater health for our communities. join us and together we will drive the future of health care. this is an exceptional opportunity to do innovative work that means more to you and those we serve at one of america's leading health care companies and a fortu"," anthem, inc  harvard, il, usa",,0
 global head of data science & analytics/ data science leader , baker hughes energy services llc ,"job requirements at baker hughes, we are building a talent community of highly talented and motivated professionals for future job roles. if you match the described job role and are as excited as we are to have you on-board in future, please hit the apply button to be a part of our talent community. as a member of our talent community, you will be amongst the first to get exclusive news about baker hughes, various cool projects we are working on, our employee success stories and new job opportun", baker hughes energy services llc  ,,0
 data science visualization engineer , saic ,"description job description: the pilot training next (ptn) contract is seeking a data visualization specialist to support the data analysis and reporting capability for the air education and training command within the united states air force. the team is seeking a motivated individual with a background in data visualization and analysis. we are a team of ""doers"" with a bias towards action and have a proven track record of implementing innovative technology solutions to solve complex challenges."," saic  austin, tx, usa",,0
 data science visualization engineer , saic ,"description job description: the pilot training next (ptn) contract is seeking a data visualization specialist to support the data analysis and reporting capability for the air education and training command within the united states air force. the team is seeking a motivated individual with a background in data visualization and analysis. we are a team of ""doers"" with a bias towards action and have a proven track record of implementing innovative technology solutions to solve complex challenges."," saic  jbsa randolph, tx, usa",,0
 data science visualization engineer , saic ,"description job description: the pilot training next (ptn) contract is seeking a data visualization specialist to support the data analysis and reporting capability for the air education and training command within the united states air force. the team is seeking a motivated individual with a background in data visualization and analysis. we are a team of ""doers"" with a bias towards action and have a proven track record of implementing innovative technology solutions to solve complex challenges."," saic  huntsville, al, usa",,0
 data engineer/data science , infinity tech group inc ,"position: data engineer location: ny or charlotte, nc (remote till covid)  duration: 9 to 12 months contract   must have extensive hands on experience in designing, developing, and maintaining software solutions in big data and data science platformsexperience building e2e data science using streaming and big data platformhands on experience on implementing  ci/cd using the atlassian ecosystemextensive hands on experience in designing, developing, and maintaining software frameworks using kafka,"," infinity tech group inc  charlotte, nc, usa",,0
 lead data science analyst , discover ,"discover. a brighter future. with us, you'll do meaningful work from day 1. our collaborative culture is built on three core behaviors: we play to win, we get better every day & we succeed together. and we mean it - we want you to grow and make a difference at one of the world's leading digital banking and payments companies. we value what makes you unique so that you have an opportunity to shine. come build your future, while being the reason millions of people find a brighter financial future "," discover  riverwoods, il, usa",,0
 data science consulting - architect , wipro ltd. ,"job decsription is as below the data scientist uses mathematics, statistics, modeling, business analysis, and technology to transform high volumes of complex data into advanced analytic solutions. the data scientist work assignments are varied and frequently require interpretation and independent determination of the appropriate courses of action. the data scientist develops, maintains, and collects structured and unstructured data sets for analysis and reporting. creates reports, projections, m"," wipro ltd.  louisville, ky, usa",,0
 data science lead , cricut ,"company descriptioncompany description  together we make. come make with us.  overview  at cricut®, we believe that we’re all born makers. when we built our first cutting machine, we saw the potential for a simple yet powerful tool to completely transform the way people craft, design, and diy. since then, we continue to innovate with new machines, platforms, materials, and tools, but that’s just what we do. who we are is a bustling worldwide community, a means for connection, and an outlet for u"," cricut  remote or south jordan, ut, usa",,1
 data science ai/ml ," datum software, inc. ","this is a full-time position with my client in atlanta, ga   sr full stack developer, decision science full term position atlanta, ga   overview & key responsibilities the sr. full stack developer will be responsible for bringing bleeding-edge machine learning and optimization models into production together with a highly multi-disciplinary team of data scientists, software development engineers, strategic partners, product managers and subject domain experts.  this role will take models develop"," datum software, inc.  atlanta, ga, usa",,0
 sr. data science - software engineer , motion recruitment ,"the company is a system security supplier and global leader in intelligent immigration and civil aviation security solutions and services, assisting governments with smarter solutions to uncover unlawful transnational activities at international border crossings (e.g., human traffickers, drug traffickers, financial criminals) they're looking for a ml/ai specialist who will partake in the creation of a new patentable technology with a focus on data using python, sql, tensorflow, spark/hadoop, and"," motion recruitment  washington, dc, usa",,0
 director of ml / data science , motion recruitment ,"this ai start-up in san mateo is looking for a director of data science. the company has a very ambitious vision to make a more intelligent search that combines nlp, recommendations, and predictive algorithms to improve lives. this search will be able to make better predictions based on user's goals and preferences to ensure that the most relevant results. with incredible vc backing, this company will make a huge splash in multiple different applications and industries. in this role, you'll be s"," motion recruitment  san jose, ca, usa",,0
 lead data science/ ai engineer , rose international ,"** and those authorized to work in the u.s. can be considered as w2 candidates.** lead principle ai engineer location: irving, tx (onsite once campus will reopen )duration: 1 year and (r2h) principle ai engineer designs and develops scalable solutions using ai tools and machine learning models. performs research and testing to develop machine learning algorithms and predictive models. being a principle ai engineer utilizes big data computation and storage tolls to create prototypes and datasets."," rose international  irving, tx, usa",,0
 data science architect , reliable software resources ,"responsibilities: provides vision, expertise and technology-based solutions in long range planning in the area of systems  architecture. serves as resident expert to conducts studies, investigate the latest technology developments  and analyze impact of current and future system requirements. recommends technology, drafts and presents  proposed corporate policies, drafts and presents proposed procedures, practices and standards. ensures that  new initiatives conform to the firm's long term strat"," reliable software resources  new york, ny, usa",,0
 python developer (nlp data science) , the consortium inc ,will accept remote and non local candidates. must have mathematical modellingpython programming   position:python developer team: item cloud (progressive team that researches and develops new technogolgies)  profile: solid python experience and stellar mathematical modeling abilities process: remote video x2 - verification - start  the python developer is responsible for the design and development of application software within the college board's information technology group. selected candidate," the consortium inc  reston, va, usa",,0
