,title,company,salary,description,location
556,Data Scientist,SYSUSA,,Support Analytics team in setting up the Business ETL and analysis architecture.Work with Mobile Analytics team in executing product performance and…,Remote
557,Machine Learning Researcher,Morgan Stanley,,Institutional Securities Technology (IST) develops and oversees the overall technology strategy and bespoke technology solutions to drive and enable the…,"New York, NY 10036 (Midtown area)"
558,"Lead Data Scientist, Marketing & Online (Remote)",The Home Depot,"$120,000 - $240,000 a year",20% Business Collaboration - Leverage extensive business knowledge into solution approach; Effectively develop trust and collaboration with internal customers…,"Remote in Atlanta, GA 30361"
559,Data Scientist,BlackHorse Solutions Inc,,Research latest data science tradecraft and technology.Minimum 6 years of experience in data science and analysis.Minimum 2 years experience in AI/ML.,"Herndon, VA 20171"
560,Statistical Analyst,LSQ,,"Proficiency in data transformation, consolidating data from disparate sources, into data visualization of analytic findings.","Remote in New York, NY 10011"
561,"Data Analyst, Pandemic Prevention Institute",ROCKEFELLER FOUNDATION,,"Perform the entire lifecycle of analysis: problem formulation, data acquisition, data cleaning, analysis across a wide array of parallel data streams, and…","Remote in Washington, DC 20037"
562,Data Analyst,Delta Faucet Company,"$75,393 - $83,093 a year","Perform intermediate level data mining and data modeling by combining multiple data sources from various systems e.g. SAP, Azure, Salesforce and other databases…",Remote
563,Data Scientists,Altair Engineering,,"The Data Factory Analyst will ensure that overall data standards, information interoperability, data quality, and data availability fully support the goals of…","Dearborn, MI"
564,Scientist,Extreme Event Solutions,,"Background in data science/machine learning highly desired.Graduate degree in a quantitative field, such as data science, statistics, mathematics, or computer…","Boston, MA"
565,"Analyst, Data and Insights (Audience Analytics)",The New York Times,,1-3 years of experience working with data analytics or data science teams to deliver reporting and analysis.Write SQL to pipeline and analyze big data.,"New York, NY"
566,Data Engineer,Wheelhouse DMG,,"Perform transformation, documentation, and testing of data flows within our data warehouse.Experience or understanding of ETL/ELT, data processing, and data…","Remote in Seattle, WA"
567,Data Scientist,Vanguard,,"Experience with data wrangling required - Programming skills to access, transform and prepare large scale data for statistical modeling.","Malvern, PA"
568,Analytics Leadership Development Program,Takeda Pharmaceutical,,"You will apply statistical, programming, data wrangling, AI machine learning, data visualization and other techniques for analyzing data.","Boston, MA"
569,Data scientist,Avila Trading,,"(Ability to write functions, clean and efficient data manipulation are mandatory for this role).Conceptual understanding in Machine Learning models like Nai¨ve…","San Francisco, CA"
570,Data Scientist,Churchome,,"Design and develop data science pipeline using PySprak, Scala, SQL, etc for parallel processing.Their duties include sifting through data points to create…",Remote
571,Data Scientist,IBSS CORP,,"Familiarity with climate models and climate data.Obtain, collate, and organize data (including but not limited to traditional and environmental DNA survey data…","Seattle, WA 98115 (Sand Point area)"
572,"Senior Analyst, Marketing Analytics",Indeed,"$99,000 - $139,000 a year","Proficiency with a wide array of data engineering tasks - data extraction, cleansing/processing, feature engineering, data integrity, maintenance, etc.",Remote in United States
573,Machine Learning Algorithm Design and Analysis Scientist R20...,Applied Research Laboratories,"$93,000 - $175,000 a year","Perform data analysis, data pre-processing, and feature engineering in support of advanced machine learning algorithm development.Paid vacation and sick time.","Austin, TX 78758 (North Burnet area)"
574,Machine Learning Engineer,Somatus,,"Partner with data scientists, data analysts, data engineers, software developers, product managers, and clinical and operations teams to deliver data solutions…","Remote in McLean, VA"
575,"Senior Data Scientist, Product Analytics",Peloton,,"Strong command of statistics and data science methodologies (e.g. hypothesis testing, regressions, and other machine learning techniques such as clustering).","New York, NY 10011 (Chelsea area)"
576,Analytics Leadership Development Program,Takeda Pharmaceutical,,"You will apply statistical, programming, data wrangling, AI machine learning, data visualization and other techniques for analyzing data.","Boston, MA"
577,Data Scientist at Sports Startup,"Predictive Sports Science, LLC",$40 - $50 an hour,Proficiency with data modeling and SQL.3+ years of experience in data modeling and handling.Design and preprocess data models in collaboration with the team’s…,"Remote in Louisville, KY"
578,Data Scientist II (Remote),MediaMath,,"Strong communication skills, and the ability to effectively discuss models with other data-scientists as well as business partners at the appropriate level of…","Remote in New York, NY 10018"
579,Statistician,Precision Consulting,,"All statisticians must have or be actively pursuing graduate degrees in statistics, applied math, data analytics, or a similar field as well as relevant…","Remote in New York, NY"
580,"Analyst, Insights and Planning",Human Interest,"$65,000 - $90,000 a year",Minimum 2+ years of experience working analytics or data science.Expertise with developing and maintaining compelling data visualizations.,"Remote in San Francisco, CA"
581,Data Analyst,DSMH LLC,$40 - $45 an hour,"This position will be working with multiple data sources and Tableau to create data visualizations.As a Digital Content Specialist, you will work on variety of…",Remote
582,Data Science/Python Instructor,Global Information Technology,,"Excellent presentation skills and the ability to interact professionally with students.4+ years in Data Science Strong familiarity with SQL, Tableau, and other…","Southfield, MI 48076"
583,BI Product Analyst,Sparibis,,"2+ years of experience in data analytics, data science, or predictive modeling leveraging SQL and BI tools preferred.Detail-oriented and attention to quality.","Remote in Los Angeles, CA"
584,Artificial Intelligence - Scientist I (Remote),Raytheon Intelligence & Space,,They need to be able to explain their decisions.They need to learn and reason in novel environments in which they have not been trained.,"Remote in Saint Louis Park, MN 55416"
585,Data Scientist - Machine Learning,Zoba,,"2+ years work experience in data science.Zoba speeds adoption of electric, sustainable urban mobility solutions by increasing operational efficiency and…","Remote in Boston, MA"
586,Senior Data Scientist,Trident Systems Inc,,"Data Analytics work will be performed on streaming sensor data including accelerometers, voltage/current sensors, communications bus messages, and other…","Hybrid remote in Fairfax, VA 22030"
587,"Senior Analyst, Marketing Analytics",Indeed,"$99,000 - $139,000 a year","Proficiency with a wide array of data engineering tasks - data extraction, cleansing/processing, feature engineering, data integrity, maintenance, etc.",Remote in United States
588,Data Scientist,1904labs,,"As a Data Scientist with 1904labs, you will be working with other data scientists, data engineers, and developers to provide analytical and data science…","St. Louis, MO 63108 (Central West End area)"
589,Data Science Analyst - Research,Mayo Clinic,"$89,773 - $134,638 a year","Has expertise in the data science methods used to analyze data, and knowledge of data types, topics, and scientific challenges and approaches.","Rochester, MN"
590,Machine Learning Engineer,Spire,"$135,000 a year",Working experience with bringing data science pipelines into production.Working with meteorological data sets from various sources.,"Remote in Boulder, CO"
591,Director Data Science,HeadSpin,,Work directly with platform and data engineers to build distributed data applications.Ability to own data features from ideation to production.,"Remote in Seattle, WA 98145"
592,"Data Scientist, Predictive Modeling",Carvana,,Aggregate and engineer data from a variety of datasets to automate data collection and processing.Our data science and analytics team automates everything…,"Phoenix, AZ"
593,Data Scientist,"Sony Pictures Entertainment, Inc.",,"Experience with big data and standardizing/ appending variables across disparate data sets.Can ingest, connect, cleanse and profile large data sets (big data)…","Culver City, CA"
594,Data Scientist,BlackHorse Solutions Inc,,Research latest data science tradecraft and technology.Minimum 6 years of experience in data science and analysis.Minimum 2 years experience in AI/ML.,"Herndon, VA 20171"
595,Engineer - Machine Learning,"Quaychain Technologies, Inc",,"Supervising the data acquisition process if more data is needed.Verifying data quality, and/or ensuring it via data cleaning.",Remote
596,Machine Learning Engineer,The Misch Group,,"Deep understanding of data structures and algorithms.Analyze data from disparate sources including images, video, radar, signals and more.","Herndon, VA"
597,Machine Learning Engineer - Content Understanding,Scale AI,,"Solid background in algorithms, data structures, and object-oriented programming.Apply state of the art models developed internally and from the community, use…","Remote in San Francisco, CA 94107"
598,Data Scientist,Surya Systems,,"Apply expertise in quantitative analysis, data mining, and the presentation of data to uncover unique actionable insights about customer service, health of…","Exton, PA"
599,Data Scientist,Peoplevisor LLC,,Develop custom data models and algorithms to apply to data sets.Assess the effectiveness and accuracy of new data sources and data gathering techniques.,"Remote in Irving, TX 75039"
600,Machine Learning Engineer - Simulation,DiDi Labs,,"Develop data processing and analytics platform to process simulation data, extract and visualize information.Also, comparing with real-road testing, simulation…","Mountain View, CA"
601,Data Science Analyst - Research,Mayo Clinic,"$89,773 - $134,638 a year","Has expertise in the data science methods used to analyze data, and knowledge of data types, topics, and scientific challenges and approaches.","Rochester, MN"
602,Analytics Leadership Development Program,Takeda Pharmaceutical,,"You will apply statistical, programming, data wrangling, AI machine learning, data visualization and other techniques for analyzing data.","Boston, MA"
603,Data Scientist,Claritas Llc,,"Support new product ideas by translating them into well-posed data science problems and solving them.Knowledge of data design and analysis, inclusive of data…","Cincinnati, OH 45236"
604,Data Scientist,"Neophoenix Industries, LLC. | Information...","$110,000 - $130,000 a year","Our client is searching for a Data Scientist to fill a remote, permanent role in a growing organization that uses AI, ML, and analytics to drive best-in-class…",Remote
605,Senior Data Scientist (Remote),Verikai,,"Utilize proper tools to clean customer data, like PySpark, R, Python, or Excel, to prepare for upcoming data analysis or modeling exercises.","Remote in San Francisco, CA"
606,Sr. Data Scientist,Global Source Analytics Inc.,"$65,000 - $135,000 a year","Experienced presenting data insights with data visualization tools (i.e. Tableau, Power BI, SSRS).Experience using other programming and data manipulation…",United States
607,Data Scientist,WorkFusion,,"Collect, clean and study data.Expertise in data analysis, classical machine learning.This position requires a data scientist with a deep understanding of…","New York, NY 10005 (Financial District area)"
608,Data Scientist,TWO NIL,,Collaborate with Data Engineering in productionizing and deploying data science applications.Familiarity with end-to-end data science workflow and various…,"Columbus, OH"
609,Artificial Intelligence - Scientist I (Remote),Raytheon Intelligence & Space,,They need to be able to explain their decisions.They need to learn and reason in novel environments in which they have not been trained.,"Remote in Saint Louis Park, MN 55416"
610,Data Scientist,Crum & Forster,,"Bachelor’s degree in associated field of study; data science, computer science, mathematics, economics, statistics, etc.","Remote in Eatontown, NJ"
611,Statistical Programmer/Analyst I,ClinChoice Inc,,"Develop SAS programmable edit checks to assist data monitoring, document and report data issue to Data Management with minimum supervision.",Remote in Pennsylvania
612,Machine Learning Researcher,Obsidian Security,,"Experience with large volumes of data, algorithms, and prototyping.MS or Ph.D. in computer science, statistics, or applied math.","Redwood City, CA 94063"
613,"Analyst, Insights and Planning",Human Interest,"$65,000 - $90,000 a year",Minimum 2+ years of experience working analytics or data science.Expertise with developing and maintaining compelling data visualizations.,"Remote in San Francisco, CA"
614,"Data Scientist - Diversity, Equity & Inclusion",Lawrence Berkeley National Laboratory,,"PhD or equivalent experience in social sciences.R language: Ability to work in R language to clean and merge data, conduct a wide variety of analyses,…","San Francisco Bay Area, CA"
615,Associate Data Scientist,Incedo,"$80,000 - $90,000 a year"," Ability to articulate problem statements to formulate data science or analytics approaches. Good working knowledge of common data science toolkits, such as…","Iselin, NJ 08830"
616,(Senior) Machine Learning Scientist - Computational Patholog...,Tempus,,"Experience with large-scale imaging data and formats (e.g., pathology images).The successful candidate will work collaboratively with a diverse team of…","Redwood City, CA"
617,Data Science - Innovation,Citi,,"Mines and analyzes data from various banking platforms to drive optimization and improve data quality.Conducts strategic data analysis, identifies insights and…","New York, NY"
618,Decision Scientist,Code Job Board,,"Recommend wider client strategies based off data-driven insights.. You'll use your knowledge of data, business and customers to shed light on these questions.","New York, NY"
619,Senior Data Scientist,Step,,"5+ years experience in data engineering or data science.A graduate degree in statistics, applied mathematics, computer science, physical sciences, or a similar…","Remote in Palo Alto, CA 94301"
620,Data Scientist in Bioinformatics and Neuroscience,Chen Lab @ Boston University,,"This person will be involved in help to analyze experimental data, developing software tools to aid in the data analysis, and helping with data infrastructure…","Boston, MA 02215 (Fenway-Kenmore area)"
621,Data Engineer,ITRGroup,"From $90,000 a year","2+ years of experience in full-stack data science product development: from exploratory data analysis, visualization to Client modeling to application/product…","Remote in Minneapolis, MN 55425"
622,Senior Data Scientist - Climate Risk and Community Resilienc...,UrbanFootprint,,"Own data science problems end-to-end, from ideation, exploratory data analysis and prototype, to collaborating with data engineers and machine learning…","Remote in Berkeley, CA"
623,Data Scientist,AmeriTEK Global,,"Fulltime job, 40 hours per week.Involved in the end-to-end lifecycle of Machine Learning(ML) models like build, train and deploy,Understand the business…","Piscataway, NJ 08854"
624,"Senior, Data Scientist",Wish,,"Experience with leading data science projects from conception to production.Become the supply data science tech lead to generate knowledge sharing, trainings…","San Francisco, CA 94103 (Mission area)"
625,LGBTQ+ Health Research Biostatistician/Data Scientist,Stanford University,,"Ph.D. in biostatistics, statistics, biomedical data science, or related field.Proficient in working with multiple data types from multiple data sources in a…","Stanford, CA"
626,Data Scientist,Dot Foods Inc.,,Work as part of the internal Data & Analytics team to ensure the optimal design of data models and pipelines to support data science initiatives.,"Remote in Chesterfield, MO 63005"
627,Data Scientist - Valuation Services,J.D. Power,,Experience with automotive market data.We make data products and every new data product we output will solve a problem in the auto industry.,"Remote in McLean, VA"
628,Machine Learning Engineer,SiteZeus,"$90,000 - $140,000 a year",Study and transform data science prototypes into scalable solutions.Experience with geospatial data is a big plus.Design and develop machine learning systems.,Remote
629,Data Scientist,BICP,,"We are looking for a mixture between a statistician, scientist, machine learning expert and engineer: someone who has passion for building and improving…","San Francisco, CA"
630,Data Scientist,Love Justice International,,"A master's degree or higher (doctoral degree preferred) in data science, research methods, statistics in the social sciences, or a related field.",United States
631,Data Scientist,Vibronyx,,"Stay current on new technologies and methods across data science and analytics, data engineering, and data visualization, share best practices to improve…",Remote
632,"Senior Analyst, Marketing Analytics",Indeed,"$99,000 - $139,000 a year","Proficiency with a wide array of data engineering tasks - data extraction, cleansing/processing, feature engineering, data integrity, maintenance, etc.",Remote in United States
633,Data Analyst - Research,SEIU 775 Benefits Group,,"A genuine passion for data science and drive to communicate using data;Exposure or experience in data governance, data engineering and/or data warehousing…","Remote in Seattle, WA 98104"
634,AI Compiler Engineer,Modular,,Strong knowledge of core compiler algorithms data structures and 2+ years of compiler experience working with code generation or ML graph transformations.,"Remote in San Francisco, CA 94103"
635,Machine Learning Engineer,Okaya Inc,$70 - $75 an hour,Data science: 8 years (Required).Data engineering: 8 years (Required).Ideal candidate should come from data engineering and last couple years involving in…,Remote
636,Data Scientist,"Calhoun International, LLC",,"Employs data science techniques to support predictive analysis, social media and crowd-source data analytics, war gaming, and strategy development.","Honolulu, HI"
637,Quantitative Researcher – Graduate,Susquehanna International Group,,"Through your research, you may discover a new pattern that can transform into a trading signal.You will work side-by-side with technologists in order to…","Bala-Cynwyd, PA"
638,Bioinformatics Scientist,"Serum, Inc.","From $120,000 a year",Experience with data science best practices to ensure reproducibility.Ensure data science reproducibility through version control and documentation in…,"Remote in Newton, MA 02458"
639,Data Scientist,Expedite Technology Solutions,"$120,000 - $130,000 a year","Pull data to develop robust scalable reporting solutions for analytics readout and insights.Experience with data visualization tools such as Data Studio,…","Austin, TX"
640,"Sr. Data Scientist, Product",Ancera,"$150,000 - $160,000 a year","This person will be responsible for applying a wide array of data science techniques to leverage Ancera and customer data to design, build, and deploy…","Branford, CT 06405"
641,Entry Level Data Scientist,I28 Technologies,"$50,000 - $55,000 a year","Knowledge with data wrangling tools such as Alteryx and Excel.R is good to have.Knowledge in visualization tools such as Power BI, Tableau, Qlikview, Spotfire…","Iselin, NJ 08830"
642,Machine Learning Engineer,Moveworks,,"Investigate and solve exciting and difficult challenges in various NLU tasks, classification, data science, content analysis, knowledge graph.","Mountain View, CA"
643,Business Intelligence Analyst,Peloton,,Working with our engineering and product teams to understand our continually evolving data sources.Extensive knowledge of manipulating large data sets using BI…,"Remote in New York, NY 10011"
644,Data Engineer,Swish Analytics,,Knowledge of data science and machine learning concepts.Experience with web scraping and cleaning unstructured data.Experience writing production level code.,"Remote in San Francisco, CA 94133"
645,Research Scientist - Data Visualization & Visual Analytics,Northeastern University,,"We seek applicants with expertise in one or more of the following data visualization areas: spatial data, scientific computing, simulation, modeling, visual…","Portland, ME"
646,"Data Scientist, Machine Learning",LifeMine,,"General understanding of life sciences concepts and data types.Familiarity with applied data science, from project design and data engineering to model…","Cambridge, MA"
647,Associate Data Scientist,Quantifind,,"Knowledge of data structures and algorithm complexity.In financial crimes risk management, Quantifind's solution uniquely combines internal financial…","Hybrid remote in Palo Alto, CA"
648,"Senior Analyst, Marketing Analytics",Indeed,"$99,000 - $139,000 a year","Proficiency with a wide array of data engineering tasks - data extraction, cleansing/processing, feature engineering, data integrity, maintenance, etc.",Remote in United States
649,Machine Learning Engineer,Zorang Technologies,"$120,000 - $130,000 a year","Machine Learning engineer has unique skills to build, code, apply correct algorithm and open-source libraries to create a ML model that best fits to the use…",Remote
650,Statistical Analyst- Remote Eligible (Health Division),Mathematica Policy Research,"$70,000 - $90,000 a year","We collaborate closely with public- and private-sector partners to translate big questions into deep insights that improve programs, refine strategies, and…","Remote in Ann Arbor, MI"
651,Data Scientist,BlackHorse Solutions Inc,,Research latest data science tradecraft and technology.Minimum 6 years of experience in data science and analysis.Minimum 2 years experience in AI/ML.,"Herndon, VA 20171"
652,"Senior Research Scientist, Applied Geophysics",MIT,,"In addition, visiting faculty and researchers from universities and industry frequently participate in ERL research and educational activities.","Cambridge, MA 02139 (MIT area)"
653,Data Scientist at Sports Startup,"Predictive Sports Science, LLC",$40 - $50 an hour,Proficiency with data modeling and SQL.3+ years of experience in data modeling and handling.Design and preprocess data models in collaboration with the team’s…,"Remote in Louisville, KY"
654,"Scientist / Sr Scientist, Data Science",Servier Pharmaceuticals LLC,,"Conduct analyses of NGS data, including.Experience with data visualization tools (ggplot2, RStudio Connect/Shiny).","Boston, MA 02210 (South Boston area)"
655,Senior Data Scientist (Remote),Prealize Health,,Develop and apply methods in Machine Learning and experimental design.Work with our advisors and keep up to date on relevant literature to ensure we use the…,Remote
656,"Senior Data Scientist, Analytics",Headspace Health,,"Design experiments and determine appropriate statistical approaches to answer specific data science, product, clinical care or business questions.","Remote in San Francisco, CA"
657,Lead Machine Learning Engineer,PathAI,,"Understand PathAI's products and services and introduce technology innovations with respect to functionality, performance, reliability, and scalability.","Remote in Boston, MA"
658,Data Scientist,Nori,"$126,000 - $156,600 a year","3-7 years of experience in data science with working knowledge of statistics and mathematics.Development of data visualizations, reports, dashboards, and data…","Seattle, WA (Victory Heights area)"
659,Research Engineer in Machine Learning Music(SAMI),TikTok,,"Masters or PhD in computer science, mathematics, engineering or related field;Masters or PhD in computer science, mathematics, engineering or related field;","Seattle, WA"
660,Associate Data Scientist - PLMI Analytics,Cleveland Clinic,,"Certification or fellowship in analytics, big data, data science or related subject preferred.Knowledge of data architecture and data base concepts.",Remote in United States
661,"Analyst, Data and Insights (Audience Analytics)",The New York Times,,1-3 years of experience working with data analytics or data science teams to deliver reporting and analysis.Write SQL to pipeline and analyze big data.,"New York, NY"
662,Head of Data / Data Science & Analytics,TalkingPoints,,"Management of multi-disciplinary data roles: data engineering, data analysis, data science.Strong track record guiding data architecture, data pipelines, data…",Remote in California
663,Sr. Data Scientist/Machine Learning Engineer,Rapinno tech solutions,$35 - $45 an hour,Experience in leading large scale data science projects and delivering from end to end.Experience in data management and data analysis in a relational database…,"Irving, TX"
664,Machine Learning Engineer,Moveworks,,"Investigate and solve exciting and difficult challenges in various NLU tasks, classification, data science, content analysis, knowledge graph.","Mountain View, CA"
665,Data Scientist,Cole Haan,,Keeps current with relevant research and novel data science methods.Explores data to find breakthroughs.Builds data science models for high priority use cases…,"Greenland, NH 03840"
