,title,company,salary,description,location
0,Data Analyst/Statistician,US Department of Veterans Affairs,"$51,980 - $103,518 a year",Create processes for assessing quality and accuracy of data.Working with healthcare data: 2 years (Preferred).Key Attributes of Successful Candidates *.,"Hybrid remote in Ann Arbor, MI 48105"
1,Data Scientist - 100% Remote,Paramount Pictures,,Working with data engineers to obtain useful and quality data for data science projects.2+ years of experience in a data analytics or data science role.,Remote
2,"Associate, Data Science (Remote)",Lincoln Financial,"$65,900 - $83,700 a year","Researches existing and emerging data science principles, theories, and techniques.Partners with manager/team leads to create visualizations & data storylines…","Remote in Radnor, PA"
3,"Data Scientist, Spotify For Artists",Spotify,,You’re a compelling storyteller who can communicate in succinct and inspiring ways to audiences with varied data science experience to influence real world…,"Remote in New York, NY"
4,Data Scientist (Remote),Yelp,"$88,000 - $220,000 a year","Communicate key insights from analyses, experiments and data products to stakeholders.Expertise in SQL, and R or Python for data analysis and platform…",Remote
5,data scientist (multiple openings) - Remote,Starbucks,,"Extracts data from various databases; performs exploratory data analysis, cleanses, massages, and aggregates data.","Remote in Seattle, WA"
6,Part-Time Student-Data Engineering-Remote,John Deere,,"Experience working with Data Scientists and deploying and supporting data science models.Develop the next generation of data products that enable secure,…","Remote in Urbandale, IA"
7,Data Scientist,the NBA,,"Comfort with ambiguity in data and experience in working with partners to optimize third-party data streams.Bachelor's Degree in computer/information science,…","New York, NY 10022 (Midtown area)"
8,Junior Data Scientist,Acima,"From $80,000 a year",Wrangle data using python or SQL to access our Redshift hosted data warehouse.We are looking for a developing data scientist that is interested in applying…,"Remote in Draper, UT 84020"
9,Junior Data Scientist,Augray,"$55,000 - $60,000 a year","Bachelor/master’s degree students pursuing degrees in data science, statistics, applied math, computer science, engineering or other quantitative fields…","Remote in Brookfield, WI"
10,Data Scientist,Oracle,,"Work on multiple stages of data science projects, including data pipeline, aggregation, feature engineering, modeling and visualization.",United States
11,Data Scientist or Bioinformatician (remote),UT Southwestern Medical Center,"$67,000 - $120,000 a year","For data scientists, the projects include assembling and statistical analyses of big clinical data, and application of machine learning and deep learning…",Remote
12,Data Scientist,OtterTune,"$100,000 - $200,000 a year","This position will involve creating data pipelines and extracting new knowledge from the telemetry data (e.g., AWS Performance Insights metrics) that OtterTune…",Remote in United States
13,Data Scientist,PlayStation Global,,Drive improvements in data quality and structure within the data warehouse.Experience with querying and working with live data.,"Remote in San Diego, CA"
14,Data Scientist - Remote Opportunity,Vaco,"$140,000 - $155,000 a year",Data Scientist 2 Work with the CTO and VP of Engineering to help normalize our data/ETL pipeline for analysis and reporting.Retirement plan with company match.,Remote
15,Data Scientist,PlayStation Global,,Drive improvements in data quality and structure within the data warehouse.Experience with querying and working with live data.,"Remote in San Diego, CA"
16,Sports Data Scientist,ESPN,,Use strategic analytical approaches and techniques using data to answer sports questions.Strong knowledge in using SQL to query and modify data from databases.,"Bristol, CT"
17,Fall 2022 Igniting Careers Diversity & Inclusion Summit – Fi...,Bank of America,,Corporate Audit: This global team maintains robust processes for reviewing risk and controls throughout the organization including a fully dedicated Automation…,"Charlotte, NC"
18,Data Scientist,ClosedLoop,,Train and educate customer data scientists on best practices for data science in healthcare.Prior experience with healthcare data science is a big plus but not…,"Remote in Austin, TX 78704"
19,Data Scientist,PGA Tour,,Work with data architects and engineers to identify key data assets and develop code to access data via APIs.Create data models and conduct advanced analytics.,"Ponte Vedra Beach, FL"
20,Data Scientist,Salesforce,,"Render results of data analyses through advanced visualization and tabular reports.Contribute to the implementation of models, experiments and metrics that…",Remote in California
21,Jr. Data Scientist,Net2Aspire,"$65,000 - $80,000 a year", Create data dashboards and other data visualization tools to track progress to inform continuous quality improvement of the Congregate Settings Investigation…,Remote
22,Mathematician/Physicist,Kall Morris Inc,"$85,800 - $114,400 a year","Plot missions involving multiple rendezvous with separate resident space objects, calculating and optimizing for delta-v consumption and mission time.",Remote
23,Data Scientist (Can Be Remote),Pancreatic Cancer Action Network,,"Oversee business data and analytics team that manages data reporting and analysis.Degree in business, statistics, mathematics, computer science, engineering,…","Remote in Manhattan Beach, CA 90266"
24,"Product Insights Manager, Music Promotion",Spotify,,"You are user-centric and data-informed.Ideally, some of these years have been in marketing sciences or advertising spaces.","Remote in New York, NY"
25,Data Scientist,PayPal,,"Regularly evaluate and communicate performance of data driven risk solutions to management.Design, develop and maintain data-driven solutions for PayPal…",Remote in Arizona
26,Data Science Manager,Discord,"$153,600 a year",Experience with very large data sets and distributed computing.Experience partnering with business teams in a data-driven culture.,"Remote in San Francisco, CA 94107"
27,Data Scientist,Journera,,"Experience with working with large data sets.Experience working with pseudonymised data (encrypted, hashed, etc).Ability to levitate things with your mind.","Remote in Chicago, IL"
28,(Junior / Senior) Data Scientist - Sports Analytics,Zelus Analytics,"$75,000 - $150,000 a year","Assist with recruiting and outreach for the data science team, including building a diverse network of future candidates.","Remote in Austin, TX"
29,Data Scientist - 2023 Entry Level Sales (Accelerate),IBM,"$73,000 - $152,000 a year","Demonstrate a growth mindset; current on technical growth in the data science space.Applying data engineering techniques to gather, prepare, cleanse, and…","New York, NY 10001 (Chelsea area)"
30,Crypto Hedge Fund Trader,Job Protocol,"$100,000 - $300,000 a year",Data modeling skills (experience in Python or other data science language).Identify valuable and predictive data sources.Starting date: as soon as possible.,Remote
31,Data Scientist (Remote),Nielsen,,"The Nielsen Company is the largest global measurement company in the world with unique measurement technologies, assets, and data that make it one of the most…",Remote in United States
32,Data Scientist,Sunshine,,You are an accomplished data scientist that thrives in analyzing data and finding key insights.Demonstrated skills in selecting the right statistical tools…,"Palo Alto, CA 94303 (Adobe Meadow - Meadow Park area)"
33,Software Development Engineer - 2023 (US),Amazon.com Services LLC,"$129,000 a year","Currently enrolled in or completed within the last 12 months a Bachelor’s or Master’s Degree in Computer Science, Computer Engineering, Data Science, Electrical…","Seattle, WA"
34,Junior Data Engineer,Pepsico,"$90,000 - $100,000 a year",Manage and scale data pipelines from internal and external data sources to support new product launches and drive data quality across data products.,Remote
35,Machine Learning Scientist,Wadhwani AI,,"We are looking for ML Scientists with experience applying AI, machine learning, and data science to real-world problems.Our accolades are as follows:",Remote
36,Data Scientist,The New York Times,,"Ability to communicate complex ideas in data science to relevant stakeholders.Experience with building data products, either internal or consumer-facing a plus…","New York, NY"
37,Data Scientist,US Geological Survey,"$61,947 - $116,788 a year","A. Degree: Mathematics, statistics, computer science, data science or field directly related to the position.Coordinates protocols and procedures necessary for…","Remote in Reston, VA"
38,Data Scientist,US Federal Energy Regulatory Commission,"$61,947 - $97,430 a year","Assessing the effectiveness and accuracy of assigned data sources and data gathering techniques, and recommending relevant process changes.This job is open to.","Washington, DC 20426 (NoMa area)"
39,Geospatial Data Science Advisor (Geographer) - Evernorth,Cigna,"$95,800 - $159,600 a year",Own development and deployment of a data quality assurance dashboard tracking our ETL processes.Develop actionable value- and data-driven communication for…,"Hartford, CT 06152 (Frog Hollow area)"
40,Data Scientist,Johns Hopkins Applied Physics Laboratory,,"Primarily apply knowledge in machine learning, artificial intelligence, data analysis, and software development to extract insights from data.","Laurel, MD 20723"
41,"PRODUCT ANALYST, DATA SCIENCE",DraftKings,,Experience with analytics or data science in a work or academic setting.You will work cross-functionally to identify high-value opportunities to implement data…,"Remote in Boston, MA"
42,Data Scientist,Middesk,,"As one of the few founding Data Scientists at Middesk, you will have the opportunity to shape the culture, technical vision and product direction of the company…",Remote in California
43,Data Science Associate (Remote),pulseData,,"Bachelor/Master Degree students pursuing degrees in data science, statistics, applied math, computer science, engineering or other quantitative fields providing…","Remote in New York, NY"
44,"Data Scientist, Advanced Microscopy",Eurofins USA,,An ideal candidate will have experience in both materials science and computer science/data science.EAG Laboratories is looking for a scientist who is eager to…,"Sunnyvale, CA"
45,Data Scientist,Piper Companies,"$130,000 - $160,000 a year","Perform data mining and data characterization to generate metrics for evaluating performance.Support Machine Learning R&D through data collection, signal…","Hybrid remote in Boston, MA"
46,Data Scientist,United Airlines Inc.,,2 years of professional data science or predictive modeling work with bachelors in statistics or master's degree in quantitative field if making career…,"Chicago, IL 60601 (Loop area)"
47,Data Engineer,FocusKPI Inc.,,"Develop tools to monitor, debug, and analyze data pipelines to ensure data quality and reliability.Have 3+ years of experience working with data warehouse/data…",Remote
48,Associate Data Scientist,GutCheck,"$80,000 - $100,000 a year","Typically, 1-3 years applying data science skills in the social or decision sciences.Support cross-functional efforts to develop databases and data feeds…","Remote in Denver, CO"
49,Director of Data Science,Oracle,,"Experience building and optimizing ‘big data’ data pipelines, architectures and data sets.Hire and develop data engineers and data scientists.",United States
50,Data Scientist,Zettalogix Inc,$50 - $62 an hour,"Experience with data visualization a plus.Masters/PhD in a quantitative field (Computer Science, Statistics, Mathematics, Operation Research, etc.).",Remote
51,Data Scientist - Machine Learning,Boston Children's Hospital,"$91,000 - $125,000 a year","Lead an effort to establish a scalable and re-usable data science framework to handle heterogeneous data sources, and propose data analytical standards across…","Boston, MA 02115 (Mission Hill area)"
52,Emerging Tech Data Scientist,Great American Insurance Company,"$100,000 a year","Translate business problems/opportunities into technical requirements and data science specifications.Develops data mining architectures/models/protocols,…",Ohio
53,Data Scientist,Holiday Swap,,"Collecting structured and unstructured data.Enhancing the data collection process.Conduct thorough data cleaning, preparation, etc.",Remote in United States
54,Data Scientist,Intuitive Cloud,$80 - $100 an hour,Data analytic and transform raw data.Be able to Curate the market data and use it like python library.Financial sql snowflake dbt at the transform layer.,Remote
55,Data Scientist,PerfectRec,"$130,000 - $300,000 a year","Exploratory data analysis and data visualization.You'll be able to evaluate and explore existing sets of data, suggest new sources of data, and be able to…","Remote in Seattle, WA"
56,"Data Scientist, Product Analytics",Etsy,,2-4 years experience in a data scientist or data analyst role in which you extracted meaning from big data sets with little engineering support.,"Remote in Brooklyn, NY 11201"
57,Quantitative Researcher,Orsus Research,"$150,000 - $300,000 a year",Orsus Research is a Quantitative Investment Firm that selects securities based on quantitative analysis.Orsus Research is seeking extraordinary Quantitative…,"Temporarily Remote in New York, NY 10022"
58,"Biomechanics Analyst, Baseball Research & Development",Cleveland Guardians - Baseball Operations,,"The ideal candidate will possess a foundation in statistics and/or data science, experience working with biomechanics data, and a thorough understanding of…","Remote in Cleveland, OH"
59,"Senior Data Analyst, Games & Live Ops",PlayStation Global,,Demonstrated analytical skills working with large sets of complex data.This position will develop and manage towards a data analytics vision for PlayStation…,"Remote in San Mateo, CA"
60,"Biomechanics Analyst, Baseball Research & Development",Cleveland Guardians - Baseball Operations,,"The ideal candidate will possess a foundation in statistics and/or data science, experience working with biomechanics data, and a thorough understanding of…","Remote in Cleveland, OH"
61,Data Scientist,Crum & Forster,,"Bachelor’s degree in associated field of study; data science, computer science, mathematics, economics, statistics, etc.What you will bring to C&F:","Remote in Eatontown, NJ"
62,Data Scientist(Data Bricks experience)-Hybrid,IPS Technology Services,$35 - $46 an hour,"The data science senior analyst must have experience interviewing users for requirements and interpreting user requirements, analyze data to support the…","Detroit, MI"
63,Statistician,Ann Arbor Pharmacometrics Group,"$80,000 - $120,000 a year",The Ann Arbor Pharmacometrics Group is a functional service provider specializing in model-based drug development consulting for the pharmaceutical industry.,"Ann Arbor, MI 48108"
64,Data Scientist,Tegria,,"As a data science expert on the team, you are expected to have general knowledge across analytics, maintain deep expertise in data science, and be comfortable…",Remote
65,Data Scientist,The Voleon Group,"$15,000 a month","Design and implement systems to ensure data correctness and monitor data health in data stores and live feeds.""Friends of Voleon"" Candidate Referral Program.","Berkeley, CA 94704"
66,Data Scientist,Toyota,,"Participate in meetings and engage with data scientists, and other team members to provide feedback and continuously improve data science standards, practices,…","Hybrid remote in Plano, TX 75023"
67,"Senior Scientist, Data Science",Invicro,,Provide influence on department strategy around data science and machine learning.Specific projects will include work in whole body PET/CT image processing…,"Needham, MA 02492"
68,Engineering & Data Science Co-Op – Spring 2023,Johnson & Johnson,,"Write software to enable collaborative data analysis and ensure data quality.Perform data analysis on structured and unstructured surgical data sets,…","Cincinnati, OH 45242"
69,Data Scientist,Workers Credit Union,"From $150,000 a year","Predictive modeling, data science and analysis: 4 years (Required).You should have at least 4 years of experience in predictive modeling, data science and…",Remote
70,Data Engineer,Detroit Red Wings,"$72,750 - $151,798 a year",Experience building data warehouses for data science and analytics.Lead the data team and data infrastructure initiatives within Hockey Operations.,"Detroit, MI 48201 (Midtown area)"
71,Data Scientist - Advanced Analytics,General Motors,"$140,000 a year",Undertake preprocessing of structured and unstructured data.Present complex information using data visualization techniques.Scripting Languages: Python or R.,Remote in United States
72,Data Scientist,Viasat,"$155,650 a year","As a member of our Media and Applications data science team, you'll work on the improving the customer experience on our mobile products through data.","Remote in Carlsbad, CA"
73,Data Scientist,Yum! Brands,,Background and/or keen interest in data analytics or science.This individual will build a variety of data insights and optimizations from our vast repositories…,Remote
74,Data Scientist,Conduent,"$82,000 - $86,715 a year","Knowledge of data warehouse, data lake and BI Solutions.Rotational assignments, learning and contributing to all aspects of the data science process including:",Remote
75,Data Analyst (Remote),pulseData,"$60,000 - $80,000 a year",You'll be cleaning and scrubbing medical record data and claims data to ensure it can be used in our data pipelines.Bonus points for any experience in Spark.,"Remote in New York, NY"
76,Pricing Data Science Analyst,Ally Financial,,"Entry level no experience required, however relevant internship experience in advanced analytics/data science preferred.","Detroit, MI (Downtown area)"
77,Data Scientist Co-Op,Asics Digital,,Use SQL queries to pull and analyze data to reveal insights to help power marketing efforts.Focus on understanding the relationships within the data that drive…,"Boston, MA"
78,Data Scientist,Aptos,,"Identify data, metrics and analyses needs for key stakeholders; Initiate, develop and maintain data pipelines and data models that powers dashboards and data…","Remote in Palo Alto, CA"
79,"Assistant/Associate Engineer, 2023 Engineering Development P...",Johnson & Johnson,,"After completing this 3-year program, participants will continue in challenging data science and engineering roles, delivering tomorrow’s surgical innovations.","Cincinnati, OH 45242"
80,Data Scientists,Ars Quanta,,"After completing this 3-year program, participants will continue in challenging data science and engineering roles, delivering tomorrow’s surgical innovations.","Seattle, WA"
81,Customer Data Scientist,Phillips Connect,"From $75,000 a year",Develop custom data models and algorithms to apply to data sets.Assess the effectiveness and accuracy of new data sources and data gathering techniques.,Remote
82,Junior Data Analyst - DAL22-033349999999,"Evergreen Technologies, LLC.",,"Experience with data wrangling, data cleaning and prep, dimensionality reduction.Bachelor's degree in mathematics, statistics, analytics, data science, or…","Remote in Detroit, MI"
83,Data Scientists,T-Mobile,"$108,136 a year","Aid in data-driven decision making paired with forward-thinking business and industry trends.Gather, cleanse and analyze data, build mathematical models, and…","Remote in Bellevue, WA 98006"
84,Entry-Level Geochemist/Data Scientist,"Life Cycle Geo, LLC","$60,000 - $80,000 a year","Familiarity with the data science/machine learning process applied to geoscientific, hydrologic, or engineering problems.Fluency in Spanish is a plus.",Remote
85,Data Scientist,AGM Tech Solutions,$75 - $85 an hour,Asynchronous time series data in big data environments.O Traffic data fusion algorithms and techniques.O Programming experience with Big Data preparation…,Remote
86,Data Scientist | US,Photon,,"Tech: Must have AWS stack, Sagemaker and python data science experience.",United States
87,Part-Time Student-Data Analytics-Remote,John Deere,,Work with internal stakeholders to define data requirements.Experience structuring data to support analysis and applications.R and/or python experience.,"Remote in Moline, IL 61265"
88,Data Scientist I,OpenX,,"Prior experience in a data science or machine learning engineer role.Depending on the jurisdiction in which you live, you may have the right to ask OpenX to…",Remote
89,Data Scientist,United Nations,,"Promotes use of data science solutions by showcasing the products to business stakeholders; Plan the dissemination of data products to key stakeholders, raise…","New York, NY"
90,Data Scientist,Cognizioni IT Solutions LLC,"$77,661 - $191,043 a year",4 Experience working with confidential data and ability to comply with all appropriate data protections and regulations.3 Experience with using git and Github.,"Remote in Weehawken, NJ 07086"
91,Data Scientist,FriendFinder Networks,"$105,000 - $125,000 a year","Perform data analysis to support executive decisions.Dive into complex data sets to analyze trends, identify opportunities and quantify the potential value of…",Remote
92,Data Analyst Associate - 2023,Capital One,,Use data mining techniques to identify fraud rings.Optimize bank ATM placement through advanced data exploration.,"McLean, VA"
93,Data Scientist,Swish Analytics,,"Contribute to all stages of model development, from creating proof-of-concepts and beta testing, to partnering with data engineering and product teams to deploy…","Remote in San Francisco, CA 94133"
94,Data Science Manager,Yale University,,Serve as the Medicaid Research Group expert in data science and database design with a focus on building scalable solutions to big data problems in health care.,"New Haven, CT 06510 (Hill area)"
95,Data Scientist (All Levels),Convoy,,"You will be responsible for defining core business logic in our data warehouse, developing insights to drive product decisions, and building data science models…","Seattle, WA 98101 (Downtown area)"
96,Associate Data Scientist,Blue Cross Blue Shield of Massachusetts,,"Assists in providing technical guidance and training to end users of data/applications.Recognizes data-related accuracy / problems, recommends potential…","Remote in Boston, MA 02199"
97,"Bioinformatician, Junior",Booz Allen Hamilton,,"1+ years of experience with data exploration, data cleaning, data analysis, data visualization, or data mining.Experience with multi-omics data analysis.","Remote in Bethesda, MD"
98,Jr. Data Scientist,Peraton,"Up to $110,800 a year",Understanding data science applications and deriving value from data to support mission objectives.Experience with data science applications and dashboarding…,"Remote in Annapolis, MD"
99,Data Scientist,KORNFERRY,,"Work closely with data scientists and engineers, and deeply understand data.Build methods and processes to measure data quality, and spot data anomalies that…",Remote
100,Data Scientist (associate level),Doorstead,,Extending company's data with third-party sources of information when needed.Enhancing data collection procedures to include information that is relevant for…,Remote
101,Data Scientist R Developer,CCIT INC,$75 - $80 an hour,Required skills with nice to have experience in the PowerBI skills and data science pipeline build experience.,Remote
102,Senior Data Scientist,Major League Baseball,,"Experience programmatically structuring and cleaning data, and not just analyzing highly cleaned data sets.Translate business challenges into data pipelines &…","New York, NY"
103,Mathematical Statistician (Social Science),US Drug Enforcement Administration,"$106,823 - $138,868 a year","Determining the availability of relevant data, performs methodological research, and generates inferences about the drug abuse problems based on comprehensive…","Arlington, VA"
104,Engineering Metrics Data Scientist - Duo Security,Duo Security,,Use your data detective and creative problem solving skills to identify and find solutions for any gaps in the data.,"Ann Arbor, MI 48104"
105,Mathematical Statistician (Social Science),US Drug Enforcement Administration,"$106,823 - $138,868 a year","Determining the availability of relevant data, performs methodological research, and generates inferences about the drug abuse problems based on comprehensive…","Arlington, VA"
106,Staff Data Scientist,"Employment Opportunities at BuzzFeed, Inc.",,"Want to build Personalization and Recommendation Systems for high data velocity consumer scale.Partner with senior engineering, product and data leadership to…","Remote in New York, NY"
107,Data Annotator,Skit.ai,,"As data associate, you will work closely with the product and machine learning team.Your role would involve taking ownership of transcribing, tagging and…","Remote in New York, NY 10007"
108,Data Scientist,Neiman Marcus,,"This position will lead data science needs across all Neiman Marcus Group brands, divisions and selling channels.Strong coding skills in Python and SQL.","Remote in Dallas, TX"
109,Data Scientist - Internet Scale AdTech Data - REMOTE,Amobee,"From $79,400 a year","Experience with big data concepts and technologies, including Spark.Dig deep into high volumes of data, engineer features for improved forecast performance.","Remote in Baltimore, MD"
110,Data Scientist,Veeco,,"Solid mathematics and statistical data analysis capability.Develop an in-depth understanding of the existing data streams available to be leveraged, and…","Remote in San Jose, CA"
